job_title,so_viec_lam
110958 technical sales engineer machinery,1
kế toán trưởng làm việc tại hà đông,1
sales thực phẩm,1
senior retail marketing team leader,1
nhân viên tư vấn trả góp tại cửa hàng thu nhập 10 20tr,1
giao dịch viên tài chính làm việc tại cửa hàng pnj phan thiết,1
trình dược viên etc khu vực vĩnh long,1
nhân viên tư vấn khách hàng ngân hàng mb bank tại cát linh đống đa tp hà nội,1
tổ trưởng bộ phận gia công,1
thực tập sinh an toàn môi trường,1
chuyên viên kỹ thuật điện lập trình plc,1
nhân viên làm bánh,1
nhân viên qc vi sinh dược thực phẩm,1
import export document staff,1
kỹ thuật viên tòa nhà,1
sales and marketing assistant,1
microsoft office product development,1
nhân viên kinh doanh thang máy alpec,1
giám sát vệ sinh công nghiệp tại hải phòng,1
chuyên viên tư vấn giáo dục ocean edu khu vực vĩnh phúc phú thọ,1
sales oversea,1
nhân viên kinh doanh làm việc tại quận 8,1
kế toán nội bộ làm việc tại củ chi,1
nhân viên kinh doanh bđs đi làm ngay,1
quản lý chuỗi cửa hàng,1
thuận an bình dương nhân viên tư vấn trả góp,1
vĩnh thanh nhơn trạch đồng nai nhân viên hỗ trợ thanh toán tại địa bàn,1
quản lý cửa hàng gạo,1
nhân viên hỗ trợ khách hàng dự án app giao hàng thu nhập lên đến 7 5 triệu,1
nhân viên trực tổng đài cho đối tác đài truyền hình số vệ tinh k không yêu cầu kinh nghiệm,1
chuyên viên telesale thu nhập từ 10 20tr nghỉ thứ 7 cn,1
trưởng nhóm cho thuê bất động sản,1
nhân viên qs làm việc ở phú quốc,1
nhân viên kinh doanh thuốc bảo vệ thực vật phân bón,1
receptionist cum office admin,1
nhân viên nghiên cứu và phát triển sản phẩm lương cứng 14 16tr,1
nhân viên phụ trách phần mềm dms,1
nhân viên hse làm việc tại kcn an hạ bình chánh tp hcm,1
quản lý cửa hàng tân phú gap,1
area manager đồng nai,1
nhân viên quản lý nhà xưởng,1
chuyên viên ub cn tam điệp,1
nhân viên quản lý chất lượng dự án ecommerce,1
chuyên viên đào tạo training executive,1
nhân viên môi trường bắc tân uyên,1
tân phú nhân viên điều dưỡng,1
nhân viên hồ sơ dự án cntt,1
nhân viên kinh doanh b2b làm việc tại kdc gia hoà đỗ xuân hợp,1
nhân viên kiểm soát nguyên phụ liệu,1
trưởng phòng đào tạo marketing tối ưu marketing,1
nhân viên tiktok fulltime,1
trình dược viên các kênh nha khoa da liễu bệnh viện,1
cà mau nhân viên tư vấn trả góp,1
tổng đài hỗ trợ khách hàng line tiếng anh thu nhập 9m 10m,1
giao dịch viên tài chính tại pnj thuận an,1
nhân viên chăm sóc khách hàng quốc tế kênh chat part time,1
biên tập viên mảng truyền thông sự kiện,1
pqc engineer,1
chuyên viên tập sự ub phòng giao dịch lâm thao cn việt trì,1
trưởng nhóm kiến trúc sư kỹ thuật cảnh quan,1
bếp chính orifood bbq hotpot aeon mall hà đông,1
trưởng nhóm quản lý qc qc manager,1
nhân viên kinh doanh ô tô đi làm ngay,1
chuyên viên tập sự khách hàng doanh nghiệp khu vực cần thơ,1
nhân viên kinh doanh mạng viễn thông khu vực huyện châu thành,1
media trainee,1
chuyên viên tập sự khách hàng cá nhân cn bình phước,1
trưởng phòng marketing thương hiệu thời trang thể thao,1
admin kiêm lễ tân văn phòng,1
chuyên viên chính cao cấp quản trị thu hồi nợ và phân tích dữ liệu khối xử lý và thu hồi nợ,1
trợ lý quản lý thi công nhà xưởng công nghiệp,1
đối tác nhà mạng viettel bổ sung vị trí cskh dịch vụ sim thẻ,1
nhân viên bán vé,1
giảng viên ngôn ngữ anh,1
nhân viên admin xuất nhập khẩu,1
kế toán tổng hợp làm việc tại phú thọ,1
kỹ sư qs mảng cây xanh,1
learning development talent development supervisor,1
112525 bim operator construction,1
nhân viên kế toán kho tại quận 2,1
thực tập sinh marketing thương mại điện tử,1
tuyển gấp giám sát bán hàng kênh gt,1
trình dược viên otc bắc ninh,1
gia lai nhân viên tư vấn trả góp smc gl,1
cán bộ phụ trách an toàn lao động công trường,1
nhân viên thủ kho nam,1
presales nhân viên kinh doanh tiền trạm,1
nhân viên tư vấn du lịch không yêu cầu kinh nghiệm,1
nhân viên quản lý phòng thí nghiệm,1
nhân viên social marketing mạnh ý tưởng kịch bản,1
nhân viên desgin kiêm digital marketing,1
hà nội tuyển tổng đài viên tp bank,1
giáo viên tiếng trung dạy tiếng việt cho người đài trung,1
quản lý văn phòng marketing,1
đầu bếp âu – đầu bếp việt,1
trợ lý kinh doanh cho giám đốc nhật tại công ty thương mại,1
bác sĩ nhi,1
phiên dịch xuất nhập khẩu kiêm dịch tài liệu,1
quảng ngãi nhân viên tư vấn trả góp tại shop,1
nhân viên hành chính cn mê linh,1
nhân viên kế toán bán hàng thu ngân thu nhập 7 10 triệu,1
nhân viên hỗ trợ kinh doanh cn vũng tàu,1
trợ lý sales,1
nhân viên giao xe,1
business assistant,1
kỹ sư thiết kế điện lạnh,1
quản lý kinh doanh vùng area sales manager,1
nhân viên chất lượng tiếng trung,1
chuyên viên nhân sự 人力資源管理師,1
kỹ thuật viên công nghệ đi làm ngay,1
trợ lí kinh doanh,1
content youtube mảng moments compilation,1
cán bộ kỹ thuật nhôm kính,1
nhân viên digital marketing zalo ads,1
nhân viên kế toán tổng hợp tại hải dương mức lương lên đến 15 triệu,1
công nhân sửa chữa vỏ container có nhận đào tạo từ đầu,1
giám đốc hậu mãi ngành ô tô,1
chuyên viên tuyển sinh ocean edu nam định 2,1
nhân viên kinh doanh lương trên 10tr tại bình tân,1
nhân viên phát triển đối tác business development,1
thiết kế rập,1
nhân viên sales đi làm ngay,1
fashion designer,1
phó phòng thẩm định doanh nghiệp,1
quản lý cửa hàng tp bảo lộc lâm đồng,1
phó phòng chất lượng deputy quality manager,1
đống đa nhân viên hỗ trợ dịch vụ khách hàng cho ngân hàng mb bank không yêu cầu kinh nghiệm làm giờ hành chính,1
trưởng phòng kinh doanh kiêm đấu thầu,1
chuyên viên marketing analyst,1
nhân viên kinh doanh đông nam bộ,1
trưởng phòng kỹ thuật in ấn bao bì,1
phó phòng chăm sóc khách hàng,1
hn327 nhân viên tuyển dụng thanh trì hà nội,1
chuyên viên tư vấn giáo dục ocean edu phủ lý lương từ 13 triệu tháng phỏng vấn đi làm ngay,1
miền bắc nhân viên bán hàng cửa hàng giấc mơ sữa việt,1
fulltime partime nhân viên cskh dự án nhà mạng vinaphone,1
trình dược viên otc tỉnh bến tre,1
phó giám đốc kỹ sư cơ khí,1
nhân viên kinh doanh đi làm ngay quận hoàng mai,1
trợ lý khối sản phẩm,1
nhân viên triển khai bản vẽ kỹ thuật abf cnc,1
tuyển dụng nhân viên kiểm duyệt hồ sơ khách hàng đối tác viettel qua hình ảnh,1
nhân viên vận hành sàn tiktok,1
nhân viên bán gói nghỉ dưỡng thcm,1
kỹ sư công nghệ cơ khí,1
phú quốc chuyên viên quản lý cơ điện mảng điện nhẹ it dự án park hyatt,1
nhân viên marketting khối văn phòng cho thuê,1
nhân viên qc ngành thực phẩm,1
leader digital maketing,1
nhân viên thiết kế ui ux website,1
chuyên viên điều phối kho bưu cục tại hà nội,1
phó giám đốc nhà máy sản xuất cấu kiện bê tông,1
chuyên viên giám sát kỹ thuật dự án,1
giao dịch viên trung tâm kinh doanh,1
trưởng bưu cục huyện cẩm xuyên hà tĩnh,1
kỹ sư thanh quyết toán công trình xây dựng,1
kỹ sư cơ điện me engineer,1
nhân viên tư vấn trả góp điện thoại xe máy thu nhập 10 20tr,1
bsv tổng đài hỗ trợ khánh hàng line 198 đối tác viettel,1
grandworld phú quốc tổ trưởng hướng dẫn,1
tuyển lập trình viên net fullstack,1
111636 sales executive chuyên viên kinh doanh machine parts,1
ga executive chuyên viên tổng vụ,1
chuyên viên khách hàng cá nhân phòng giao dịch thuận an cn bình dương,1
nhân viên hành chính cn hậu giang,1
nhân viên tư vấn bán hàng quận 5,1
nhân viên content marketing ngành mỹ phẩm,1
nhân viên lễ tân chung cư tnpm rox key 1n324,1
quản lý chuyên môn tiểu học,1
kỹ sư thiết kế hệ thống cơ điện,1
non trade ap accountant,1
qa supervisor hưng yên,1
key account executive toàn quốc,1
debug technician kỹ thuật viên,1
phó phòng quản lý thi công,1
nhân viên rửa xe,1
nhân viên kỹ thuật ưu tiên nam có bằng lái xe b2 15mil gross vnđ biên hòa đồng nai,1
thực tập sinh truyền thông nội bộ tp hcm,1
chuyên viên khách hàng doanh nghiệp phòng giao dịch hải hậu cn nam định,1
trưởng nhóm vận hành sàn,1
giao dịch viên khu vực hải phòng bắc ninh,1
thực tập sinh content seo website full time part time,1
nhân viên hành chính nhân sự tiếng trung,1
nhân viên tư vấn trả góp tại tuyển gấp,1
nhân viên kỹ thuật máy may,1
thuận an bình dương nhân viên hỗ trợ qc,1
nhân viên truyền thông báo chí q7,1
nhân viên kinh doanh tư vấn kế hoạch tài chính,1
business development associate nhân viên kinh doanh phát triển khách hàng doanh nghiệp,1
it helpdesk it support,1
nhân viên kỹ thuật điện thi công sửa chữa – nhận và giao hàng bảo hành từ công trình,1
nhân viên sales du lịch đi làm ngay,1
corporate legal manager,1
nhân viên phát triển thị trường quận huyện đăng ký,1
nhân viên tư vấn bán hàng tân phú,1
chuyên viên khách hàng doanh nghiệp phòng giao dịch hoàng diệu cn khánh hòa,1
trưởng bộ phận marketing thương mại điện tử 12 17tr,1
kỹ sư giá thành hạng mục m e,1
chuyên viên kinh doanh thị trường keo dán gạch weber,1
diễn họa kiến trúc 3d artist,1
quản lý ie,1
quản lý vận hành kho,1
nhân viên kinh doanh khu vực thái nguyên,1
bsv tuyển nhân viên tuyển dụng,1
vehicle rental manager,1
chuyên viên vận hành máy kv hải dương nghệ an,1
nhân viên dự toán giá thầu,1
nhân viên qa dược phẩm,1
quản lý kho chi nhánh bến cát,1
tân uyên bình dương nhân viên tư vấn trả góp,1
nhân viên vận hành sàn tmđt kinh nghiệm 6 tháng thu nhập 12 triệu tháng,1
sales engineer kỹ sư bán hàng ngành khí nén điều khiển chiếu sáng,1
nhân viên qc điện,1
chuyên viên kinh doanh sales bán hàng thu nhập từ 16 triệu trở lên hồ chí minh,1
vận hành cad,1
brse kỹ sư cầu nối tiếng nhật n1,1
nhân viên chăm sóc khách hàng mạng viễn thông viettel,1
việc làm tuyển dụng nvvp 12 12,1
trình dược viên otc tỉnh sóc trăng,1
quản lý nhãn hàng brand manager,1
113872 sales manager consulting,1
nhân viên kỹ thuật rạp chiếu phim galaxy mipec long biên hà nội,1
kế toán nội bộ kiêm hcns,1
kinh doanh kiêm kỹ thuật,1
kỹ thuật viên autocad 2d cầu đường,1
kỹ sư thiết kế công trình xử lý nước cấp nước thải ngành môi trường,1
chuyên viên kinh doanh kênh mt otc,1
nhân viên kiểm duyệt hồ sơ dự án viettel vdc,1
chuyên viên nhân sự tiền lương,1
chuyên viên sale thị trường,1
nhân viên bán hàng qua điện thoại thu nhập lên đến 30tr,1
đại diện kinh doanh kiêm học vụ mảng giáo dục steam,1
nhân viên kỹ thuật điện mặt trời,1
trưởng bưu cục gia lâm,1
phú quốc nhân viên kỹ thuật mảng me khu nhà phố thương mại cấp,1
hạ hòa phú thọ nhân viên tư vấn trả góp smc pt,1
nhân viên idea sản phẩm pod,1
quản lý vận hành vận tải,1
sales export nhân viên kinh doanh xuất nhập khẩu,1
qc dự án,1
trưởng nhóm phát triển thương hiệu,1
chuyên viên chuyên viên cao cấp kế toán tổng hợp,1
chuyên viên quản lý điều phối lớp học,1
nhân viên hỗ trợ nhà hàng thu nhập đến 8 3 triệu làm tại quận 7,1
nhân viên livestream mỹ phẩm cao cấp,1
nhân viên bán hàng qua tổng đài viettel làm việc giờ hành chính tại hòa lạc thạch thất,1
chuyên viên chính chuyên viên xử lý nợ bắc ninh,1
công nhân cơ điện điện lạnh,1
trình dược viên kênh otc khu vực miền tây,1
phó phòng hcns fmcg,1
operation incentive analyst team lead,1
nhân viên bán hàng kênh trọng điểm key account,1
mobile developer iot,1
nhân viên tư vấn bán hàng viettel store tại hà tĩnh,1
aeon long biên nhân viên siêu thị,1
tiktok branding executive,1
nhân viên thủ kho hà nội,1
nhân viên kinh doanh phát triển thị trường quảng trị lương cứng 8 10tr hoa hồng thu nhập 15 30tr,1
phó phòng hcns phụ trách tuyển dụng,1
risk management leader,1
kỹ sư shopdrawing hà nội,1
chuyên viên phòng hành chính quản trị,1
kiến trúc sư thiết kế nội thất,1
nhân viên sales admin trung tâm tiếng anh,1
nhân viên dựng thu nhập 17 20tr đi làm ngay,1
ga,1
giáo viên ai robotic mầm non,1
nhân viên tư vấn trực tiếp thu nhập 40 triệu trở lên đi làm ngay,1
nhân viên thủ kho nhà máy bình dương,1
lễ tân partime,1
nhân viên phát triển thị trường nhật bản,1
nhân viên hành chính tổ chức thi,1
bác sĩ làm việc tại định quán đồng nai,1
nhân viên chăm sóc khách hàng sàn thương mại điện tử số 1 việt nam không yêu cầu kinh nghiệm hỗ trợ mộc thực tập cho sinh viên năm cuối,1
chuyên viên tư vấn giáo dục lương từ 13 triệu ocean edu vinh phỏng vấn đi làm ngay,1
nhân viên nhân sự tiếng hàn,1
nam đại diện kinh doanh,1
nhân viên kinh doanh nội thất biên hòa,1
trưởng phòng phát triển mặt bằng,1
nhân viên admin hành chính,1
nhân viên bán hàng long xuyên,1
chuyên viên tư vấn giáo dục ocean edu gang thép,1
sinh viên thực tập sinh electrical automation intern,1
đại diện kinh doanh sales representative đồng nai,1
trợ lý cửa hàng burger king,1
telesales intern,1
chuyên viên tư vấn bảo hiểm fulltime part time,1
trường phòng kinh doanh b2b ngành tròng kính,1
kỹ sư xây dựng làm tại hà nội bắc giang,1
marketing intern qtsc q12,1
nhân viên quản lý thiết bị tại ban điều hành,1
nhân viên telesale viettel làm việc giờ hành chính tại hòa lạc thạch thất,1
giám sát công trình nội thất,1
giám đốc vận hành trường học thu nhập 30 35 triệu,1
nhân viên tư vấn căn hộ lương tại thanh xuân hưng yên nam từ liêm,1
chuyên viên content quảng cáo,1
nhân viên kinh doanh mảng thiết bị y tế,1
kỹ sư thiết kế bản vẽ biện pháp thi công shopdrawing,1
nhân viên sản xuất tiếng hàn,1
ai engineer,1
chuyên viên nghiên cứu phát triển học liệu tiếng anh,1
nhân viên kinh doanh sales tour inbound – làm việc tại hà nội,1
nhân viên chứng từ logistic logistics customer service executives,1
fit up supervisor work at an hạ industrial zone bình chánh district hcm city,1
long an nhân viên tư vấn trả góp smc la,1
nhân viên tư vấn bất động sản tư vấn căn hộ lương 10 60tr,1
chuyên viên khách hàng cá nhân phòng giao dịch thượng lý cn bắc hải phòng,1
chuyên viên kinh doanh marketing,1
trưởng nhóm seo website,1
chuyên viên kinh doanh thu nhập tới 14tr tháng,1
nhân viên thiết kế cơ,1
116277 sales leader foods,1
trợ lý phòng dịch vụ,1
trưởng phòng đào tạo phát triển,1
export documentation customer services,1
quản lý thiết kế dự án,1
quality assurance nhân viên quản lý chất lượng,1
nhân viên chạy quảng cáo facebook,1
mechanical technician,1
giám sát quầy hàng tươi sống winmart đức trọng,1
video editor metub originals,1
trưởng kinh doanh khu vực kênh fs gt ngành hàng thực phẩm tiêu dùng nhanh,1
nhân viên tạp vụ kiêm phụ bếp nhà hàng chay,1
bắc ninh nhân viên kinh doanh giao hàng tận nhà,1
nhân viên kinh doanh mảng năng lượng mặt trời,1
kỹ thuật viên chăm sóc bể cá,1
nhân viên kiểm duyệt hồ sơ qua hình ảnh dự án viettel,1
3d junior artist,1
tổng đài viên hỗ trợ khách hàng viettel,1
giám sát khu vực loại 2,1
nhân sự sale kiêm điều hành vận tải,1
garment mechanic manager,1
internal audit nhân viên kiểm toán nội bộ,1
kỹ sư thiết kế giải pháp cơ khí,1
nhân viên kỹ thuật kết cấu,1
nhân viên bảo trì tòa nhà biết me,1
110141 customer support gaming,1
cskh tiếng nhật n2 thử việc full lương,1
chuyên viên đào tạo cấp cao,1
quản lý tiếp thị thương mại vùng,1
off trade channel manager,1
công nhân sản xuất không yêu cầu kinh nghiệm,1
nhân viên hse csr esg,1
trưởng máy in,1
lái xe ô tô,1
chuyên viên tập sự khách hàng doanh nghiệp khu vực hà nội,1
vận hành máy rót,1
giám sát đào tạo,1
chuyên viên liên kế trường ocean edu hội sở,1
sample development chief trưởng phòng phát triển mẫu,1
nhân viên phụ kho biết lái xe nâng,1
trưởng phòng nhân sự và văn hóa,1
110468 technical support chemical,1
nhân viên kinh doanh máy cnc hn,1
nhân viên qs xây dựng hải phòng,1
nhân viên kinh doanh sales bất động sản 10 60tr,1
game server programmer,1
nhân viên mua hàng tiếng trung tiếng anh,1
chuyên viên quản lý quy trình,1
chuyên viên khách hàng cá nhân phòng giao dịch kiến an cn nam hải phòng,1
nhân viên telesales tư vấn chốt đơn bán hàng qua điện thoại làm giờ hành chính tại tân bình,1
nhân viên y tế hành chính nhân sự,1
kỹ sư mep,1
nhân viên đón tiễn khách hàng tại sân bay tân sơn nhất,1
clinic operations assistant,1
nhân viên kinh doanh căn hộ có hỗ trợ data marketing,1
tuyển telesales thẻ cho ngân hàng quốc tế,1
tuyển dụng nhân viên tư vấn mở thẻ ngân hàng,1
admin cum accountant,1
tiếng trung mua hàng,1
business analyst associate,1
trưởng kinh doanh khu vực đồng tháp,1
chuyên viên thiết kế và quy hoạch,1
giám đốc nhà máy sản xuất giấy,1
nhân viên thư ký văn phòng,1
nhân viên marketing thiết kế,1
nũ hộ sinh thực hành,1
bác sĩ răng hàm mặt cơ hữu,1
nhân viên kinh doanh lương kinh doanh 16 9 triệu,1
kỹ thuật hiện trường kỹ thuật công trình,1
nhân viên vận hành sàn thương mại điện tử lương thu nhập up to 20m,1
kỹ thuật bảo trì thang máy,1
nhân viên khai thác trong nước,1
trưởng nhóm vận hành tiktok,1
109822 hn plastics sales executive trading nhân viên kinh doanh mảng nhựa thương mại,1
nhân viên kinh doanh sơn dcolex thu nhập upto 25 triệu tháng,1
trưởng nhóm nhắc phí qua điện thoại cph hni,1
nhân viên bán hàng làm tại sân bay tân sơn nhất,1
nhân viên phát triển thị trường khu vực bình tân,1
chuyên viên tư vấn kênh b2b,1
phiên dịch kiêm mua hàng,1
cửa hàng phó siêu thị mini,1
điều dưỡng hậu phẫu,1
nhân viên kinh doanh bắc ninh,1
nhân viên kinh doanh ngồi tại văn phòng,1
tư vấn viên hỗ trợ dịch vụ dự án ngân hàng tpbank,1
kỹ sư thiết kế điện tử,1
nhân viên thiết kế đồ họa lương upto 20 triệu,1
kỹ thuật viên khúc xạ nhãn khoa,1
gereral affairs executive,1
chuyên viên khách hàng doanh nghiệp phòng giao dịch bãi cháy cn quảng ninh,1
trường phòng kinh doanh,1
chuyên viên phát triển mạng lưới,1
kế toán nội bộ tại đà nẵng,1
trưởng nhóm mua hàng tiếng nhật,1
trình dược viên online,1
trưởng phòng team leader học thuật,1
giám sát bán hàng otc khu vực bình dương bình phước tây ninh,1
nhân viên kinh doanh máy móc khai thác,1
kỹ sư điện miền nam,1
trưởng nhóm quản lý lớp học cskh,1
nhân viên hàn đường ông áp lực và thợ phụ đi làm ngay,1
e commerce development executive,1
trình dược viên khánh hòa,1
sales engineer nhân viên kinh doanh kỹ thuật,1
sìn hồ lai châu nhân viên tư vấn tín dụng kênh trả góp smc lcu,1
nhân viên chăm sóc khách hàng xử lý khiếu nại sàn tmđt kênh chat,1
nhân viên hỗ trợ khách hàng dự án viettel ap,1
sales development leader trưởng nhóm phát triển kinh doanh khí đặc biệt 18 25mil,1
nhân viên bán hàng qua điện thoại có sẵn data,1
nhân viên hồ sơ đối ngoại,1
nhân viên tư vấn cskh không yêu cầu kinh nghiệm,1
trình dược viên không cần kinh nghiệm,1
đại diện bán hàng,1
chuyên viên kiểm soát nhiễm khuẩn,1
quản lý sản xuất bắc ninh,1
nhân viên kế toán doanh thu tổng hợp,1
21018 career advisor in hcmc,1
tư vấn viên thẩm mỹ phòng khám,1
chuyên viên kỹ thuật hạ tầng khu công nghiệp,1
recruitment intern,1
đại diện kinh doanh nhân viên kinh doanh,1
nhân viên thư ký văn phòng xưởng,1
kcn bàu bàng thủ kho bảo trì,1
nhân viên vận hành sàn thương mại điện tử quận 12,1
chuyên viên kiểm toán nội bộ và quản trị rủi ro tại hcm,1
kĩ thuật viên giày mẫu,1
brand executive ngành f b,1
đại diện kinh doanh hcm,1
thực tập sinh môi giới chứng khoán,1
nhân viên kế toán hải phòng,1
nhân viên văn phòng tiếng nhật kênh chat,1
chuyên viên quản lý tài khoản khách hàng,1
nhân viên kinh doanh sales sơn thép cuộn pcm sơn xe hơi,1
kế toán tổng hợp ngành hàng vải jean tân phú,1
nhân viên vận hành sản xuất thức ăn thủy sản,1
giám sát nhà hàng chuỗi steak,1
nhân viên kinh doanh dự án môi trường,1
hcm nhân viên bán hàng kiêm thu ngân nhãn hàng thời trang cao cấp luxury brand,1
nhân viên tư vấn trả góp tại cửa hàng điện thoại xe máy nghệ an sed na,1
nhân viên kinh doanh sỉ nhạc cụ,1
nhân viên bảo vệ làm việc tại bắc giang,1
kỹ sư thiết kế cơ khí ngành máy tự động,1
trưởng nhóm đào tạo – tuyển dụng,1
nhân viên kinh doanh thu nhập 16 25 triệu,1
barista,1
chuyên viên chứng từ logistic logistics customer service executives,1
nhân viên kỹ thuật làm việc quận 7 – nhận việc ngay,1
nhân viên kinh doanh nội thất không kinh nghiệm,1
content creator vj tiktok sáng tạo nội dung video,1
quản lý cửa hàng winmart kv tỉnh quảng nam,1
phó phòng mua hàng hà nội,1
nhân viên kỹ thuật không yêu cầu kinh nghiệm,1
trình dược viên etc khu vực cần thơ,1
chuyên viên designer,1
nhân viên bán hàng trực tiếp tại sự kiện tặng quà green,1
nhân viên bán hàng khu vực thanh xuân,1
nhân viên xuất nhập khẩu khai quan,1
nhân viên lái xe ôtô,1
nhân viên qc in ấn,1
phú quốc nhân viên hành chính bộ phận cây xanh cảnh quan,1
mega gangnam chuyên viên thiết kế,1
chuyên viên quản lý dòng tiền,1
cửa hàng phó osifood kv huyện tân túc,1
nhân viên kinh doanh phụ gia chế biến thủy sản,1
chuyên viên tư vấn tuyển dụng tokutei,1
nhân viên chăm sóc khách hàng cho dự án k part time tối,1
nhân viên nhân sự tiếng nhật open for freshers,1
tổng đài viên chăm sóc khách hàng tiếng khmer tiếng campuchia,1
nhân viên telesale thẻ ngân hàng quốc tế,1
video editor media marketing,1
call center interpreters remote,1
kỹ sư nông nghiệp agriculture technical staff,1
trưởng team phát triển dự án,1
digital performance marketing executive,1
chăm sóc khách hàng tiếng nhật quận 11,1
chuyên viên kế hoạch tổng hợp kiêm trợ lý,1
tuyển dụng nhân viên thu mẫu,1
telesales tư vấn y khoa,1
thực tập sinh điều hành tour,1
trưởng nhóm kỹ thuật bảo hành,1
thủ kho làm việc kcn tân tạo hcm chơn thành bình phước,1
chuyên viên cao cấp pháp chế mảng bất động sản,1
customer success specialist（saas）tiếng nhật n2 cứng,1
giám đốc kinh doanh gt miền bắc,1
chuyên viên mua hàng quốc tế làm việc tại nam hà nội,1
nhân viên thiết kế tại hưng yên,1
nhân viên seo content writer,1
nhân viên chăm sóc da,1
nhân viên trưng bày brand cotton on quận 1 quận 2,1
kế toán thanh toán kiêm thủ quỹ,1
tuyển dụng giáo viên tiếng anh,1
telesales phần mềm,1
chỉ huy trưởng công trình thi công điện mặt trời,1
nhân viên kiểm tra chất lượng vùng nguyên liệu,1
bình dương nam nhân viên lab sản xuất 3 ca,1
resin sales staff,1
nhân viên tư vấn ngân hàng quốc tế singapore không yêu cầu kinh nghiệm,1
giám đốc kinh doanh làm việc tại đắk lắk,1
sale online thẩm mỹ viện,1
chuyên viên c b dầu tiếng bình dương,1
