job_title,so_viec_lam
cộng tác viên customer service remote,1
nhân viên sales tour ota,1
thủ kho biết lái xe nâng,1
chuyên viên tư vấn khách hàng ngân hàng quốc tế singapore citibank,1
quản lý nội bộ đi làm ngay,1
thủ kho tem túi nguyên vật liệu,1
nhân viên văn phòng quản lý chứng từ đội xe,1
phó giám đốc khách sạn,1
sales engineer b2b,1
nhân viên kinh doanh telesale bình tân quận 6,1
110775 sales manager communication,1
tuyển tổng đài viên đối tác ngân hàng techcombank làm việc tại hội sở không yêu cầu kinh nghiệm,1
nhân viên thị trường khu vực hưng yên,1
nhân viên thiết kế designer tại hà nội thu nhập 12 000 000 15 000 000,1
thực tập sinh qc,1
nhân viên sale admin biết tiếng anh,1
hostlive tuyển dụng trên tiktok,1
quản lý kinh doanh vùng kênh etc hcm,1
senior marketing,1
phó giám đốc marketing,1
nhân viên lễ tân spa đi làm ngay,1
trưởng bộ phận thiết kế uiux,1
data executive,1
senior material specialist,1
chuyên viên sale thiết bị y tế,1
nhân viên hỗ trợ thanh toán địa bàn điện bàn đại lộc quảng nam cfi qnm,1
nhân viên sale vé tham quan du lịch,1
giáo viên tiếng trung part time full time,1
nhân viên quản lý và cho thuê tòa nhà hà nội,1
nhân viên sale kinh doanh,1
nhân viên bốc xếp hàng lên xe tải,1
nhân viên tư vấn không yêu cầu kinh nghiệm thu nhập từ 16 triệu,1
trợ lý ngành hàng tiếng trung,1
kỹ sư hiện trường phòng cháy chữa cháy,1
phó phòng kinh tế kế hoạch,1
chuyên viên callcenter,1
nhân viên kiểm duyệt hồ sơ khách hàng đối tác viettel không yêu cầu kinh nghiệm,1
giám sát kinh doanh làm việc tại hải phòng,1
nhân viên content mkt,1
nhân viên tư vấn gói thăm khám sức khỏe pvi insurance petro vietnam không yêu cầu kinh nghiệm data có sẵn,1
kế toán trưởng khu vực lân cận quận 2,1
quản lý nhà hàng steak,1
kế toán trưởng tại tây ninh đi làm ngay,1
chuyên viên tập sự khách hàng cá nhân phòng giao dịch bình long cn bình phước,1
quản lý cửa hàng quận 1 quận 2 bình thạnh levi s,1
chuyên viên thiết kế mep,1
kỹ thuật hiện trường đi làm ngay,1
content writer full time,1
r d executive market research,1
chuyên viên khách hàng doanh nghiệp thị xã quảng yên cn uông bí,1
giáo viên toán part time online,1
nhân viên kỹ thuật côn trùng,1
chuyên viên thẩm định dự án công nghệ,1
nhân viên tư vấn nước hoa biết tiếng anh,1
nhân viên nam kho,1
trưởng nhóm tư vấn thẩm mỹ,1
phiên dịch trợ lý tiếng trung,1
cửa hàng trưởng cửa hàng bán lẻ xăng dầu,1
chuyên viên kế hoạch kỹ thuật alphanam group,1
tổ trưởng chăm sóc động vật,1
chuyên viên sale telesale online,1
faculty assistant,1
assistant manager bộ phận bản mạch smt1,1
web administrator,1
quản gia căn hộ mẫu,1
chuyên viên tư vấn bảo hiểm kênh đối tác ngân hàng shinhan chi nhánh sài gòn,1
tổ trưởng thu ngân co opmart cần giờ,1
nhân viên quản lý đối tác,1
nhân viên chăm sóc khách hàng tổng đài viên tiếng campuchia tiếng khmer không yêu cầu kinh nghiệm,1
android developer jr mid,1
nhân viên kinh doanh thị trường khu vực hồ chí minh vũng tàu,1
chuyên viên kinh doanh tư vấn bđs,1
nhân viên chăm sóc khách hàng hãng điện tử toshiba xoay ca giờ hành chính chấp nhận sinh viên chờ bằng,1
chỉ huy trưởng công trường tại hà nội,1
academic coach quận 7,1
đồng xuân phú yên nhân viên hỗ trợ thanh toán địa bàn cfi py,1
nhân viên thiết kế nội thất interior design staff,1
trưởng phòng kinh doanh đồng nai,1
electronics after sales services,1
hn321 giám đốc nhân sự gia lâm hà nội,1
tài xế xe đào,1
thực tập sinh nhân viên chăm sóc khách hàng dự án vinaphone,1
nhân viên kinh doanh giáo dục,1
chuyên viên kế toán chi nhánh hà nội,1
hcm nhân viên kiểm soát chất lượng sản phẩm ngành may mặc,1
chuyên viên ub phòng giao dịch thủy nguyên cn bắc hải phòng,1
nhân viên cơ khí tổ nguội,1
nhân viên bán hàng tiêu dùng kênh đại lý tạp hóa chợ,1
qc kiểm hàng thời trang nữ,1
thực tập sinh graphic design,1
logistics sales executive,1
kỹ sư tiêu chuẩn hệ thống sản xuất,1
nhân viên telesales viettel tại cầu giấy hà nội,1
it communicator,1
kế toán nhà máy sản xuất nội thất,1
nhân viên kinh doanh telesales không yêu cầu kinh nghiệm,1
nhân viên kinh doanh lương 9 đến 30tr tháng nghỉ thứ 7 chủ nhật,1
trợ lý phiên dịch,1
chuyên viên hành chính nhân sự mạnh kpis,1
nhân viên telesale mbbank,1
nam nhân viên sửa chữa ô tô,1
nhân mua hàng biết tiếng hàn,1
nhân viên kinh doanh vũng tàu tây ninh bình dương bình thuận,1
nhân viên chứng từ đội xe logistics documentation staff,1
thư ký tiếng hàn,1
admin tuyển sinh mầm non,1
sales admin team leader,1
kỹ sư lập trình nhúng embedded,1
administrative specialist for overseas branch,1
nhân viên kinh doanh xăng dầu,1
nhân viên kinh doanh thị trường làm việc tại hồ chí minh bình phước vũng tàu,1
tây ninh giám sát kinh doanh kênh xe máy smc tn,1
chuyên viên tư vấn thu nhập từ 10 20 tháng triệu trở lên,1
nhân viên bán hàng thời trang cao cấp hồ chí minh thu nhập upto 10m tháng,1
nhân viên kết câu,1
tuyển dụng nhân viên hành chính nhân sự hoàng mai,1
kỹ sư lập trình trí tuệ nhân tạo,1
nhân viên khai thác hàng hóa,1
quản lý cừa hàng trưởng thời trang cao cấp,1
kế toán viên digitex,1
b2b sales executive leader chuyên viên kinh doanh tiếng anh,1
giám sát kinh doanh vùng miền bắc gt,1
qc lab technician,1
trưởng nhóm kinh doanh spa thẩm mỹ viện,1
nhân viên nam đóng gói làm ca tại nhà máy,1
kiểm duyệt viên hồ sơ làm xoay ca tại bắc từ liêm,1
nhân viên qc tại hà nam,1
marine inspector,1
trưởng nhóm qc trưởng phòng qc,1
hà nội nhân viên hỗ trợ thanh toán địa bàn ba vì cfi hni,1
nhân viên marketing freetraffic automation,1
quyền quản lý kinh doanh,1
phụ bếp tại các chuỗi nhà hàng,1
nhân viên kinh doanh xe,1
tư vấn bán hàng đồng hồ garmin tại fpt shop,1
quản lý bưu cục tại hải phòng,1
giáo viên ielts full time part time,1
cán bộ kỹ thuật công trường miền bắc,1
thư ký kinh doanh ngành ô tô,1
tài xế giao hàng đi làm ngay,1
chuyên viên khách hàng cá nhân cn thanh oai,1
trưởng phòng kế hoạch đấu thầu,1
chuyên viên tập sự khách hàng doanh nghiệp phòng giao dịch diễn châu cn nghệ an,1
quản lý cửa hàng bình thạnh menbur,1
thực tập sinh trợ lý kiểm toán viên,1
chuyên viên tư vấn giáo dục ocean edu tân yên,1
giám đốc trung tâm khách hàng doanh nghiệp cmbc long thành,1
trưởng nhóm kế toán bán hàng,1
nhân viên kinh doanh hà nội hưng yên bình dương,1
kế toán bán hàng tại showroom,1
key account executive – kênh tt tây ninh,1
nhân viên sale online mảng y tế thẩm mỹ,1
nhân viên trực tổng đài viettel,1
nhân viên tư vấn tuyển sinh tại gia kiệm,1
bảo vệ tòa nhà văn phòng quận 1 tphcm,1
nhân viên sale admin làm việc tại văn phòng công ty,1
customer service document,1
nhân viên trực tổng đài 198 viettel,1
chuyên viên viết chương trình tiếng anh mầm non,1
nhân viên kỹ thuật điện thu nhập trên 15 triệu,1
trưởng bộ phận nhân sự,1
nhân viên pha chế bartista,1
quản lý sales tư vấn bán hàng,1
bsv tuyển nhân viên kiểm duyệt hồ sơ nhà mạng viettel,1
trưởng nhóm telesale thu nhập 15 25tr nghỉ thứ 7 cn,1
tổng vụ tiếng nhật n3 n2,1
nhân viên kinh doanh ban giao dịch và đàm phán hà đông,1
phó giám đốc chi nhánh phụ trách khách hàng cá nhân tp hcm,1
tuyển dụng công nhân sản xuất làm việc trong nhà xưởng chế độ đầy đủ,1
kỹ sư xây dựng tại quảng nam,1
chuyên viên audit hcns,1
chuyên viên marketing đa kênh,1
thực tập sinh biên tập viên môn toán,1
nhân viên liên lạc bác sĩ,1
giảng viên an toàn lao động hóa,1
nhân viên bán sản phẩm tâm linh tâm điền yên tử,1
talent acquisition intern,1
nhân viên xuất nhập khẩu mua hàng tại long biên,1
nhân viên điều dưỡng phụ mổ,1
chuyên viên ub phòng giao dịch hưng hà cn thái bình,1
chuyên viên kinh doanh bán lẻ,1
kế toán tổng hợp general accountant,1
trợ lý kế toán,1
trợ lý giám đốc quản lý dự án tài chính,1
117172 hcm sales manager quản lý bộ phận kinh doanh hcm construction,1
chuyên viên tư vấn tuyển sinh education consultant,1
nhân viên kinh doanh thiết bị máy móc đi làm ngay,1
nhân viên lễ tân phòng khám khu vực tây nam bộ,1
chuyên gia kế hoạch kinh doanh và quản lý hiệu quả khối sme,1
nhân viên tư vấn bán hàng làm việc tại văn phòng,1
nhân viên sale e commerce b2b hà nội,1
nghiệp vụ đấu giá tài sản,1
nhân viên tư vấn phát triển thị trường kyc kinh nghiệm,1
chuyên viên tập sự ub phòng giao dịch buôn hồ cn đăk lăk,1
nhân viên chăm sóc khách hàng đài truyền hình vtvcab xoay ca linh hoạt,1
nhân viên kinh doanh tour sales tour,1
nhân viên thống kê trang trại,1
chuyên viên quản lý phần mềm ứng dụng,1
giám sát vận tải,1
nhân viên kinh doanh tại đà nẵng,1
head of category fresh food,1
hiệu phó tiểu học thu nhập 18 25 triệu,1
chuyên viên tư vấn giáo dục ocean edu khoái châu thu nhập từ 13 triệu trở lên phỏng vấn đi làm ngay,1
nhân viên tổng đài dịch vụ khách hàng,1
nhân viên kinh doanh phát triển thị trường khu vực long an lương cứng 9 12tr hoa hồng,1
graphic designer chuyên viên thiết kế,1
tổ trưởng kỹ thuật tòa nhà chung cư,1
nhân viên kinh doanh bán hàng sales ngành ô tô mazda láng hạ,1
trưởng bộ phận kinh doanh trái phiếu cổ phiếu,1
cơ hội việc làm ngay sau tết tìm kiếm nhân viên chăm sóc khách hàng bên tp bank,1
trưởng nhóm giám sát vận hành,1
tư vấn bán hàng qua điện thoại gói sức khỏe pvi thu nhập 18 triệu,1
nhân viên kinh doanh có kinh nghiệm sale tour đoàn,1
qa coordinator admin,1
đầu bếp phụ nhà hàng,1
chuyên viên kinh doanh bđs tâm linh,1
kỹ thuật viên kiêm tư vấn làm việc tại thủ dầu một,1
nhân viên content youtube content marketing,1
kỹ thuật mực in,1
nhân viên giao hàng thuốc,1
quản lý khu vực hải phòng,1
brand marketing excutive,1
nhân viên cấp phép bản quyền âm nhạc,1
nhân viên tư vấn và triển khai phần mềm marketing workflow automation,1
quản lý bán hàng kênh mt,1
giám sát vệ sinh khu vực,1
nhân viên bán hàng b2b ngành cơ khí thu nhập trên 10 triệu,1
trưởng nhóm seo marketing seo leader,1
nhân viên kỹ thuật lắp đặt cơ khí,1
contact centre service sales representative,1
admin tiếng trung phòng kế toán,1
nhân viên phát triển đối tác ht mầm non quốc tế,1
trình dược viên đồng tháp – thu nhập 9 20tr,1
nhân viên kinh doanh khu vực sơn la,1
trưởng nhóm tiêu chuẩn,1
nhân viên hành chính lễ tân receptionist cum administrative,1
nhân viên kinh doanh gt mt,1
trợ lý tgđ,1
quản lý bếp trung tâm,1
chuyên viên cvc cvcc khách hàng doanh nghiệp bình dương bình phước long an,1
113689 solution product marketing assistant manager printing,1
nhân viên vận hành máy sản xuất thực phẩm,1
tổ trưởng nhà hàng chi nhánh đặng nguyên cẩn,1
chuyên viên kinh doanh ngành thực phẩm chức năng,1
kỹ sư qa qc tại hải phòng lương cao đãi ngộ cạnh tranh,1
mua hàng quốc tế,1
nhân viên hỗ trợ thanh toán tại địa bàn khu vực mekong,1
chuyên viên điều phối công trình,1
bn339 oba nhân viên kiểm tra chất lượng kcn quế võ mở rộng upto 25tr,1
sales executive chuyên viên kinh doanh mảng xuất khẩu lao động 1 năm kinh nghiệm,1
senior android developer,1
nhân viên bảo vệ nội bộ công ty,1
thợ hàn tig mig,1
international sales executives chuyên viên kinh doanh quốc tế,1
kế toán vận đơn,1
nhân viên content seo website fanpage,1
nhân viên livestream không áp doanh số,1
kế toán tổng hợp mảng xây dựng bất động sản,1
quản lí triển khai,1
giám đốc sàn bđs lương từ 20tr,1
nhân viên thu hồi nợ hiện trường ta149,1
kỹ thuật viên spa clinic lương từ 10 15tr tháng,1
nhân viên vận hành máy phụ trợ,1
hcm nhân viên chăm sóc khách hàng đối tác nhà mạng vinaphone,1
sales leader ngành mỹ phẩm,1
nữ kế toán trưởng,1
nhân viên triển khai,1
nhân viên sales online – làm việc tại văn phòng,1
trưởng nhóm vận hành đào tạo,1
chuyên viên hcns phụ trách qhlđ audit,1
chuyên viên maketing tuyển dụng,1
nhân viên admin dược,1
thực tập sinh sale du lịch,1
kỹ sư phần mềm developer odoo,1
kỹ sư tư vấn giải pháp hệ thống mạng bảo mật,1
116203 sales executive general trading,1
nhân viên mua hàng trong nước tại hà nội,1
nhân viên kinh doanh khu vực hcm – bình dương – biên hòa,1
nhân viên kỹ thuật khai thác vận hành mạng isp,1
nhân viên vẽ cad cad cam cae design manager,1
nhân viên bán hàng vũng tàu,1
quản lý cửa hàng tân phú hcm,1
việc làm sale siêu thị gia lai,1
nhân viên kinh doanh hạt nhựa,1
nhân viên chăm sóc khách hàng cho nhà mạng viettel không yêu cầu kinh nghiệm,1
digital mkt,1
kỹ thuật giám sát thi công lắp dựng kết cấu thép,1
total rewards executive,1
thuận an bình dương nhân viên kinh doanh tập sự,1
nhân viên sale xuất khẩu lương cứng 8 15tr doanh số,1
senior human resources specialist,1
chuyên viên quản lí kênh thương mại điện tử,1
nhân viên hỗ trợ thanh toán tại địa bàn tỉnh đồng nai,1
nhân viên chăm sóc khách hàng kênh viettel 4g,1
trợ lý trưởng phòng hành chính nhân sự,1
php laravel intern,1
kỹ sư kế hoạch,1
hỗ trợ viên chăm sóc khách hàng cho đối tác ngân hàng tp bank,1
nhân viên bán hàng trực page quản lý sàn tmđt,1
nhân viên kỹ thuật 15 20 tr,1
trưởng nhóm kinh doanh nội thất,1
quản lý cửa hàng tokyolife quỳnh côi quỳnh phụ thái bình,1
thừa thiên huế nhân viên hỗ trợ thanh toán địa bàn phú lộc cfi tth,1
junior technical engineer,1
kỹ sư địa hình địa chất,1
trưởng phòng hành chánh nhân sự mạnh tuyển dụng,1
nhân viên tư vấn bán hàng ô tô khu vực tiền giang,1
garment accessory purchasing trim,1
vũ phạm hàm tuyển nhân viên telesale thẻ tín dụng không yêu cầu kinh nghiệm làm việc giờ hành chính,1
nv vận hành máy cnc,1
operations supervisor,1
nhân viên kinh doanh thép và inox,1
sbg chuyên viên bán hàng môi trường năng lượng,1
operations air export freight forwarder,1
nhân viên kinh doanh khu vực bắc từ liêm tây hồ,1
nhân viên kỹ thuật bảo trì toà nhà,1
chuyên viên livestream,1
kinh tế xây dựng,1
nhân viên kinh doanh thu nhập trung bình 10 20 triệu cơ hội cho sinh viên mới ra trường,1
yên sơn tuyên quang nhân viên hỗ trợ thanh toán tại địa bàn cfi tq,1
trưởng phòng phát triển thị trường khu vực bình dương,1
hn nhân viên kho nước alba,1
giảng viên cơ hữu khối sức khỏe,1
quản lý cửa hàng tại thanh hóa,1
thư ký hđqt kiêm thư ký giám đốc,1
trưởng bộ môn toán trưởng phòng phụ trách chuyên môn,1
quản lý kinh doanh kênh etc dịch vụ miền tây,1
long khánh nhân viên kinh doanh ban giao hàng tận nhà,1
nhân viên sales marketing biết tiếng anh,1
nhân viên bếp múc phở phụ bếp,1
hcm thực tập sinh tuyển dụng,1
tester senior,1
vận hành kho nhân viên kho kiêm giao hàng,1
kỹ thuật hiện trường công trình kiến trúc nội thất,1
nhân viên phục vụ partime,1
chuyên viên tư vấn bảo hiểm kênh đối tác ngân hàng seabank hải phòng,1
nhân viên kinh doanh tư vấn bán hàng ô tô,1
chuyên viên điện vận hành cáp treo,1
chuyên viên an ninh thông tin và bảo mật,1
việc làm sale siêu thị lâm đồng,1
tuyển nhân viên chăm sóc khách hàng dự án yamaha thời vụ không yêu cầu kinh nghiệm,1
trưởng nhóm tuyển sinh ocean edu ba vì thu nhập hấp dẫn từ 15 triệu tháng,1
nhân viên lái xe làm việc tại đồng tháp,1
nhân viên kinh doanh khu vực huế nha trang,1
chuyên viên kinh doanh full time part time,1
tester junior edtech,1
phó phòng kỹ thuật bảo trì sân gôn,1
trưởng phòng dịch vụ visa,1
senior it governance specialist,1
nhân viên content marketing tiếng anh,1
116812 tiếng nhật phó phòng chất lượng ngành sản xuất,1
quản lý cửa hàng tommy hilfiger quận 1,1
nhân viên lễ tân lương thưởng hấp dẫn,1
nhân viên thu cước và phát triển khách hàng hải dương,1
phụ trách kinh doanh mảng dịch vụ,1
giám sát housekeeping stewarding,1
chuyên viên phát triển đối tác,1
nhân viên tư vấn qua điện thoại tại tân bình,1
giao dịch viên tài chính tại pnj gia lai,1
nhân viên kinh doanh vật tư xây dựng,1
nhân viên chăm sóc khách hàng dự án viettel không yêu cầu kinh nghiệm,1
tổng đài viên vỗ trợ khách hàng dự án ngân hàng quân đội,1
chăm sóc khách hàng tpbank ba đình hai bà trưng bắc từ liêm,1
nhân viên chăm sóc khách hàng đặt hẹn,1
nhân viên admin thời vụ 6 tháng,1
bác sĩ sản phụ khoa cơ hữu,1
nhân viên tư vấn tuyển sinh kinh doanh sales consultant thu nhập hấp dẫn lên đến 30 triệu tháng ila bình tân quận 6 tân phú,1
tester intern fresher,1
nhân viên event teambuilding,1
chuyên viên tư vấn bảo hiểm kênh đối tác ngân hàng shinhan chi nhánh quận 9,1
kế toán kiêm chăm sóc khách hàng,1
kĩ thuật viên spa phun xăm,1
senior qa engineer,1
nhân viên hỗ trợ kinh doanh tư vấn trả góp thu nhập lên đến 15 triệu đồng,1
quản lý telesales ngành hàng fmcg nhập khẩu,1
nhân viên thu ngân kiêm kế toán,1
đối tác tpbank nhân viên chăm sóc được chọn địa điểm làm việc không cần kinh nghiệm,1
giám đốc tư vấn sản phẩm,1
nhân viên chăm sóc và phát triển khách hàng,1
sales b2b nha trang,1
nam nhân viên kho thời trang,1
quản lý khu vực hà tĩnh,1
tuyển bảo vệ,1
nhân viên vận hành sản xuất cơ điện cơ khí,1
nhân viên hỗ trợ thanh toán địa bàn cfi vl,1
kỹ sư thiết kế cơ khí máy,1
phó trưởng ca sản xuất từ 3 năm kinh nghiệm upto 15m gross,1
kiểm duyệt viên hồ sơ khách hàng viettel,1
editor quản lý tiktok,1
huế trưởng nhóm kinh doanh chuyển phát nhanh,1
bắc từ liêm nhân viên trực tổng đài 198 viettel xoay ca linh hoạt không yêu cầu kinh nghiệm,1
nhân viên ads facebook tiktok,1
phó phòng kinh doanh khách hàng doanh nghiệp chailease,1
chuyên viên khách hàng cá nhân khu vực hóc môn tp hồ chí minh,1
chuyên viên kế toán chi nhánh,1
qa qc staff 11 12 mil gross,1
trưởng nhóm kinh doanh bảo hiểm,1
kỹ thuật viên spa có tay nghề thu nhập 15 30tr,1
giao dịch viên hải phòng,1
chuyên viên tư vấn giáo dục ocean edu chí linh thu nhập từ 13 triệu tháng,1
nhân viên quản trị kênh,1
r d product marketing specialist executive,1
nhân viên bảo vệ thu nhập trên 11 triệu,1
chuyên viên tập sự ub phòng giao dịch thượng lý cn bắc hải phòng,1
nhân viên kinh doanh thu nhập lên đến 30tr,1
đại diện kinh doanh tại sóc trăng,1
kinh doanh bán lẻ tại hcm,1
huge fam cook,1
bùi thị xuân bình định nhân viên tư vấn trả góp kênh điện máy sed bđ,1
sales giáo dục,1
trợ lý phiên dịch tiếng trung thu nhập từ 15 đến 20 triệu,1
trưởng nhóm chuyên viên market research business analyst,1
pr leader,1
giảng viên cơ hữu khối kinh tế,1
nhân viên theo dõi đơn hàng merchandiser,1
tuyển dụng sup kênh mt,1
nhân viên hành chính văn phòng làm việc với sàn thương mại điện tử thu nhập 7 10 triệu,1
nhân viên soạn thảo hồ sơ mảng dược mỹ phẩm thực phẩm trang thiết bị y tế,1
sales staff tiếng anh hoặc tiếng nhật n3,1
nhân viên khai thác hàng hóa tại yên phong,1
nhân viên kỹ thuật đấu nối tủ điện,1
hn234 chuyên viên kinh doanh nam từ liêm hn 9 12tr,1
tuyển thự c tập sinh kinh doanh,1
kỹ sư bảo trì cơ khí,1
sales admin id22922,1
chuyên viên tập sự khách hàng cá nhân cn bắc sài gòn,1
kế toán tổng hợp nữ,1
nhân viên chăm sóc khách hàng sàn thương mại điện tử hỗ trợ ca parttime cho sinh viên không yêu cầu kinh nghiệm đào tạo có lương,1
nhân viên kinh doanh thị trường lương lên đến 25 000 000,1
admin thư ký kinh doanh,1
nhân viên tư vấn đào tạo,1
hà nội tuyển quản lý vùng,1
nhân viên vệ sinh máy bay,1
chuyên viên khách hàng doanh nghiệp phòng giao dịch sầm sơn cn thanh hóa,1
thực tập sinh trợ lý sản xuất,1
chuyên viên trader,1
117492 sales staff nhân viên kinh doanh và hỗ trợ khách hàng it network,1
nhân viên lễ tân tòa nhà chung cư,1
nhân viên bảo vệ ca 12 tiếng,1
inside sales representative,1
kỹ sư embedded firmware engineer,1
chuyên viên kinh doanh giải pháp kỹ thuật,1
hành chính nhân sự tiếng nhật n2 up to 18tr gross,1
nhân viên vận hành siêu thị,1
nhân viên chăm sóc khách hàng online,1
tổng đài viên kênh viettel 198 không áp sale không yêu cầu kinh nghiệm,1
kế toán nội bộ,1
bsv tuyển nhân viên cskh line 198 tổng đài viên viettel xoay ca,1
nhân viên kỹ thuật nghề gia công cơ khí,1
trưởng phòng kinh doanh online ngành thời trang thu nhập 20 30tr,1
nữ bán hàng đi thị trường tại đồng nai,1
nhân viên cơ điện việt úc an giang,1
sales representative exp in medical devices medical supplies laboratories,1
thực tập sinh kinh doanh phần mềm miniaapp,1
kế toán chuyên quản,1
công nhân vận hành nam,1
nhân viên lễ tân bệnh viện,1
nhân viên bảo trì nhà hàng,1
fm supervisor,1
nhân viên quảng bá tiếp thị,1
quản lý khu vui chơi parc mall champion 1250,1
quản lý nhà hàng nhật bản,1
giám sát thi công hoàn thiện nội thất tại phú quốc hà nội vĩnh phúc,1
chuyên viên kinh doanh làm việc tại hải phòng,1
nhân viên tư vấn giải pháp phần mềm quản lý bán hàng lương cơ bản upto 13tr hoa hồng upto 43 đãi ngộ hấp dẫn được đào tạo bài bản,1
nhân viên qs xây dựng,1
nhân viên kinh doanh mảng hoa tươi,1
quản lý khu vực chuỗi nhà hàng alacarte,1
kỹ sư lắp ráp và sơn máy móc xây dựng,1
nhân viên đo lường,1
sales engineer kỹ sư kinh doanh,1
quản lý trung tâm anh ngữ ms hoa ielts fighter,1
nhân viên kinh doanh – tuyển gấp,1
phó phòng kế hoạch sản xuất,1
nhân viên giám sát kỹ thuật nội thất,1
nhân viên bán hàng làm việc tại hải phòng,1
nhân viên kế toán thời vụ,1
thợ chính điện lạnh,1
nhân viên đóng hàng,1
nhân viên kho nguyên vật liệu,1
nhân viên content marketing 2 năm kinh nghiệm hà nội,1
nhân viên kinh doanh sale máy bán hàng tự động,1
nhân viên kinh doanh tư vấn sales bất động sản,1
nhân viên chăm sóc khách hàng app social video thu nhập đến 8 5 triệu không ca đêm quận tân phú,1
nhân viên kỹ thuật in,1
kế toán doanh nghiệp thương mại,1
tổng đài viên tư vấn thu nhập 10 20tr,1
kiểm soát viên cao cấp kv hồ chí minh,1
kỹ sư thiết kế kết cấu nhà cao tầng,1
assistant executive,1
kỹ thuật viên nước cấp nước thải,1
nhân viên kinh doanh thị trường khu vực đồng tháp bến tre trà vinh,1
junior account,1
chuyên viên lập trình software developer,1
nhân viên tư vấn hệ thống arena multimedia,1
chuyên viên tập sự khách hàng doanh nghiệp cn hòa lạc,1
trợ lý công trình tiếng trung）,1
giám đốc chi nhánh ocean edu phú thọ thu nhập hấp dẫn từ 24 triệu tháng,1
trưởng phòng marketing quận 12 thời trang nữ,1
nhân viên phụ kho ngành hàng mẹ và bé,1
nhân viên kho spare part bảo trì,1
nhân viên digital marketing google,1
bsv tuyển tổng đài viên cskh viettel xoay ca,1
kê toán doanh thu,1
nhân viên livestream tiktok,1
