job_title,so_viec_lam
nhân viên kinh doanh,765
kế toán tổng hợp,451
chuyên viên kinh doanh,184
nhân viên kế toán,172
chuyên viên tư vấn giáo dục,166
chuyên viên tư vấn tài chính kênh liên doanh ngân hàng bidv,154
trưởng phòng kinh doanh,152
nhân viên chăm sóc khách hàng,148
nhân viên kỹ thuật,146
kế toán trưởng,144
chuyên viên tuyển dụng,123
nhân viên hành chính nhân sự,114
nhân viên bán hàng,112
nhân viên marketing,109
nhân viên kinh doanh thị trường,106
kế toán nội bộ,95
trưởng phòng marketing,94
nhân viên tư vấn trả góp,92
nhân viên kế toán tổng hợp,91
kế toán thuế,82
nhân viên tuyển dụng,78
nhân viên kho,78
nhân viên mua hàng,78
nhân viên thiết kế,76
nhân viên content marketing,67
nhân viên qc,63
kỹ sư xây dựng,61
chuyên viên marketing,61
kế toán kho,61
sales admin,58
nhân viên telesale,58
graphic designer,56
nhân viên digital marketing,56
nhân viên thu mua,56
nhân viên bảo trì,54
kế toán viên,54
chuyên viên đào tạo,54
nhân viên xuất nhập khẩu,54
kiến trúc sư,53
chuyên viên tuyển sinh,53
trưởng nhóm kinh doanh,52
chuyên viên pháp chế,52
giáo viên tiếng anh,52
chuyên viên digital marketing,52
nhân viên tư vấn tuyển sinh,51
quản lý cửa hàng,51
nhân viên sale admin,49
nhân viên kế hoạch sản xuất,49
chuyên viên nhân sự,49
trưởng phòng hành chính nhân sự,49
trình dược viên otc,48
content marketing,48
kỹ sư qs,47
cửa hàng trưởng,47
kế toán thanh toán,46
giám đốc kinh doanh,46
digital marketing,45
kỹ sư điện,45
nhân viên lễ tân,44
nhân viên tư vấn bán hàng,44
nhân viên kế toán nội bộ,43
video editor,43
kế toán bán hàng,42
nhân viên kế toán thuế,41
chuyên viên tư vấn giáo dục thu nhập từ 13 triệu tháng phỏng vấn đi làm ngay,41
sales executive,41
trợ lý giám đốc,40
thủ kho,40
kế toán công nợ,40
marketing executive,39
chăm sóc khách hàng,39
nhân viên kế toán kho,38
chuyên viên mua hàng,38
trợ lý tổng giám đốc,37
chuyên viên tư vấn bảo hiểm kênh liên doanh ngân hàng bidv,37
nhân viên vận hành máy,37
nhân viên thủ kho,37
sales manager,36
content creator,35
nhân viên kinh doanh b2b,35
nhân viên telesales,35
kỹ sư cơ khí,35
nhân viên kinh doanh không yêu cầu kinh nghiệm,35
chuyên viên tư vấn tuyển sinh,34
chuyên viên trade marketing,34
quản lý sản xuất,34
nhân viên sales admin,33
tư vấn bán hàng,33
nhân viên phát triển thị trường,33
trình dược viên,32
trợ lý kinh doanh,32
sale admin,32
nhân viên phục vụ,32
nhân viên kỹ thuật điện,32
chuyên viên thiết kế,31
giám sát công trình,31
chuyên viên hành chính nhân sự,31
nhân viên it,31
giám sát kinh doanh,30
nhân viên media,30
nhân viên thiết kế đồ họa,30
nhân viên kinh doanh quốc tế,30
nhân viên quay dựng,30
kỹ sư thiết kế cơ khí,30
chuyên viên kế toán,30
nhân viên cơ điện,30
nhân viên hành chính,30
giáo viên mầm non,29
chuyên viên kiểm soát nội bộ,29
nhân viên phụ kho,29
chuyên viên kế toán tổng hợp,29
nhân viên content,28
nhân viên kế toán bán hàng,28
trình dược viên etc,28
nhân viên qa,28
giám sát bán hàng kênh gt,28
chuyên viên tài chính,28
trưởng nhóm tuyển dụng,28
nhân viên phát triển kinh doanh,27
nhân viên livestream,27
sales engineer,27
chủ nhiệm lớp anh ngữ,27
chuyên viên chăm sóc khách hàng,26
chỉ huy trưởng,26
giám sát thi công,26
trưởng nhóm marketing,26
chuyên viên media,26
kỹ sư hiện trường,26
nhân viên sale thị trường trà sữa,26
chuyên viên tư vấn,25
chuyên viên tư vấn bảo hiểm kênh hợp tác ngân hàng mb,25
nhân viên hỗ trợ thanh toán tại địa bàn,25
chuyên viên c b,25
nhân viên kinh doanh online,25
digital marketing executive,25
nhân viên kinh doanh bất động sản,24
nhân viên thiết kế nội thất,24
kỹ sư thiết kế,24
nhân viên vận hành sàn thương mại điện tử,24
phiên dịch tiếng trung,24
kỹ sư kinh tế xây dựng,24
nhân viên kinh doanh dịch vụ viễn thông,23
trưởng phòng nhân sự,23
kỹ sư nông nghiệp,23
nhân viên kinh doanh phần mềm,23
nhân viên kinh doanh dự án,23
nhân viên kinh doanh nội thất,23
nhân viên bán hàng đa nhiệm,22
nhân viên kinh doanh thiết bị y tế,22
nhân viên nhân sự,22
marketing manager,21
tổ trưởng sản xuất,21
chuyên viên kinh doanh b2b,21
nhân viên lái xe,21
thực tập sinh kinh doanh,21
nhân viên bảo vệ,21
nhân viên sale online,21
nhân viên kỹ thuật cơ khí,20
nhân viên hành chính lễ tân,20
trưởng nhóm tư vấn tuyển sinh,20
phó phòng kinh doanh,20
thực tập sinh kế toán,20
nhân viên tư vấn,20
nhân viên thẩm định,20
đại diện kinh doanh,20
nhân viên kinh doanh đi làm ngay,19
điều dưỡng viên,19
trợ lý tiếng trung,19
business development manager,19
nhân viên kinh doanh xuất khẩu,19
business development executive,19
thực tập sinh marketing,19
chuyên viên quay dựng,19
nhân viên văn phòng,19
nhân viên y tế,19
nhân viên kỹ thuật tòa nhà,19
trình dược viên kênh otc,19
nhân viên kỹ thuật bảo trì,18
nhân viên kinh doanh vật liệu xây dựng,18
kỹ thuật viên,18
trade marketing,18
nhân viên pháp chế,18
chuyên viên tư vấn giáo dục thu nhập từ 13 triệu tháng,18
nhân viên hành chính văn phòng,18
business analyst,18
thực tập sinh nhân sự,18
thực tập sinh tuyển dụng,18
chuyên viên phát triển kinh doanh,18
nhân viên chứng từ xuất nhập khẩu,17
nhân viên thu ngân,17
nhân viên bảo trì điện,17
chuyên viên kế toán thuế,17
nhân viên kế hoạch,17
trợ giảng tiếng anh,17
chuyên viên nhân sự tổng hợp,17
chuyên viên tư vấn trả góp ô tô,17
general accountant,17
nhân viên bảo trì cơ điện,17
nhân viên kế toán thanh toán,17
hành chính nhân sự,17
giám đốc chi nhánh,17
chuyên viên kinh doanh dự án,17
kế toán giá thành,17
quản lý kinh doanh,17
chuyên viên content marketing,17
nhân viên seo,17
chuyên viên kinh doanh quốc tế,16
nhân viên quản lý chất lượng,16
kỹ sư cơ điện,16
nhân viên video editor,16
kỹ thuật viên spa,16
nhân viên bảo trì cơ khí,16
quản lý dự án,16
phó phòng kế toán,16
nhân viên nhân sự tổng hợp,16
nhân viên cơ khí,16
sales staff,16
kỹ sư thiết kế điện,16
chuyên viên tuyển dụng đào tạo,16
nhân viên kinh doanh xuất nhập khẩu,16
nhân viên admin,16
trade marketing executive,15
assistant brand manager,15
nhân viên vận hành máy cnc,15
nhân viên bán hàng thời trang,15
nhân viên hỗ trợ kinh doanh,15
chuyên viên kinh doanh bất động sản,15
giao dịch viên tài chính tại cửa hàng pnj,15
quản lý kho,15
quản lý nhà hàng,15
trưởng nhóm chăm sóc khách hàng,15
quản lý cửa hàng thời trang thể thao,15
nhân viên hành chính nhân sự tổng hợp,15
tư vấn bán hàng đa nhiệm,15
nhân viên phụ bếp,14
nhân viên kế toán công nợ,14
giáo viên chủ nhiệm,14
nhân viên sales,14
marketing leader,14
nhân viên qa qc,14
nhân viên r d,14
giám sát bán hàng,14
account executive,14
trưởng nhóm tuyển sinh,14
nhân viên khai báo hải quan,14
nhân viên kinh doanh logistics,14
chuyên viên phân tích dữ liệu,14
key account manager,14
chuyên viên telesales,14
nhân viên thị trường,14
nhân viên quay dựng video,14
digital marketing leader,13
chuyên viên thu mua,13
brand manager,13
quản lý cửa hàng thời trang,13
nhân viên kinh doanh phát triển thị trường,13
kỹ sư trắc đạc,13
nhân viên content creator,13
lao động phổ thông,13
chuyên viên truyền thông nội bộ,13
giám sát thi công nội thất,13
nhân viên phiên dịch tiếng trung,13
kỹ sư giám sát xây dựng,13
nhân viên thiết kế 3d,13
phiên dịch tiếng hàn,13
kỹ sư shopdrawing,13
nhân viên thiết kế cơ khí,13
nhân viên trade marketing,13
trình dược viên otc không cần kinh nghiệm,13
trưởng nhóm trade marketing,13
nhân viên thống kê sản xuất,13
nhân viên thiết kế thời trang,13
telesales,13
chuyên viên thiết kế đồ họa,13
nhân viên booking kol koc,13
nhân viên kho vận,12
chuyên viên phát triển dự án,12
chuyên viên hành chính,12
kế toán dự án,12
trưởng ca sản xuất,12
project manager,12
nhân viên lái xe văn phòng,12
công nhân sản xuất,12
kỹ sư giám sát công trình,12
chuyên viên content,12
nhân viên tư vấn trả góp tổng thu nhập từ 10 triệu trở lên,12
nhân viên kinh doanh ô tô,12
chuyên viên seo,12
nhân viên kinh doanh kênh gt,12
nhân viên đấu thầu,12
merchandiser,12
nhân viên an toàn lao động,12
nhân viên kỹ thuật cơ điện,12
nhân viên it helpdesk,12
chuyên viên quay dựng video,12
marketing intern,12
nhân viên marketing ads,12
trưởng phòng mua hàng,12
thực tập sinh hành chính nhân sự,12
chuyên viên truyền thông,12
chuyên viên tư vấn giáo dục lương từ 13 triệu tháng,12
nhân viên trực page,11
giám sát nhà hàng,11
trưởng phòng kỹ thuật,11
trưởng phòng quản lý chất lượng,11
giám sát sản xuất,11
kỹ sư m e,11
sales leader,11
nhân viên tư vấn du học,11
nhân viên sale,11
phiên dịch viên tiếng trung,11
nhân viên quản lý đơn hàng,11
nhân viên thiết kế rập,11
chủ nhiệm lớp anh ngữ thu nhập từ 13 triệu tháng,11
chuyên viên it,11
nhân viên kcs,11
nhân viên tư vấn bán hàng lương 8m 12m,11
nhân viên dịch vụ khách hàng,11
nhân viên giao hàng,11
nhân viên hse,11
nhân viên lễ tân hành chính,11
sales logistics,11
kỹ sư thiết kế kết cấu,11
nhân viên kế toán giá thành,11
bác sĩ da liễu,11
nhân viên kỹ thuật sản xuất,11
nhân viên kỹ thuật lắp đặt nam,11
chuyên viên đấu thầu,11
chỉ huy trưởng công trình,11
chuyên viên r d,11
nhân viên tư vấn trả góp trực tại cửa hàng xe máy điện thoại tổng thu nhập từ 8tr tháng,10
chuyên viên qc,10
nhân viên sale marketing,10
nhân viên phiên dịch tiếng hàn,10
nhân viên kinh doanh kênh mt,10
kỹ thuật viên bảo trì,10
trợ lý dự án,10
chuyên viên phát triển thị trường,10
kỹ sư kết cấu,10
nhân viên tạp vụ,10
quản đốc sản xuất,10
nhân viên giao nhận,10
trade marketing specialist,10
nhân viên hành chính kế toán,10
kế toán tổng hợp thuế,10
chuyên viên mua hàng tiếng trung,10
nhân viên kỹ thuật hiện trường,10
leader marketing,10
nhân viên marketing online,10
backend developer,10
nhân viên kiểm soát chất lượng,10
kỹ sư qa qc,10
chuyên viên pháp lý,10
chuyên viên phân tích nghiệp vụ,10
kỹ sư kinh doanh,10
trưởng phòng kinh doanh bất động sản,10
it helpdesk,10
nhân viên tư vấn chăm sóc khách hàng,10
nhân viên tư vấn thẩm mỹ,9
bsv nhân viên tư vấn văn phòng dịch vụ viettel,9
leader content,9
hành chính nhân sự tổng hợp,9
chuyên viên kỹ thuật,9
nhân viên qs,9
kỹ sư dự toán xây dựng,9
chuyên viên tư vấn đi làm ngay,9
quản lý chi nhánh,9
điều dưỡng,9
nhân viên văn phòng biết tiếng trung,9
kỹ thuật hiện trường,9
business development,9
nhân viên kiểm soát nội bộ,9
nhân viên bán hàng tại showroom,9
trưởng nhóm digital marketing,9
thư ký dự án,9
quản lý vùng,9
giám sát hiện trường,9
kỹ thuật viên khúc xạ,9
nhân viên tư vấn trả góp trực tại cửa hàng,9
nhân viên kinh doanh horeca,9
nhân viên logistics,9
giáo viên tiếng trung,9
giáo viên tiểu học,9
phó phòng tài chính kế toán,9
kế toán,9
chuyên viên dịch vụ khách hàng,9
chuyên viên hành chính nhân sự tổng hợp,9
kế toán quản trị,9
nhân viên kinh doanh hà nội,9
nhân viên sale thị trường,9
nhân viên phiên dịch tiếng nhật,9
trợ lý sản xuất,9
nhân viên an toàn,9
makerting manager,9
đầu bếp,9
nhân viên kinh doanh thị trường trình dược viên otc,9
nhân viên facebook ads,9
nhân viên hỗ trợ thanh toán địa bàn,8
quản lý khu vực,8
trưởng phòng hành chính,8
giáo viên toán,8
tư vấn tuyển sinh,8
kiến trúc sư nội thất,8
giáo viên tiếng anh mầm non,8
kỹ sư giám sát,8
international sales executive,8
kế toán ngân hàng,8
nhân viên thiết kế kỹ thuật,8
tư vấn viên tại spa,8
trưởng nhóm telesales,8
kỹ sư bán hàng,8
kỹ sư tự động hóa,8
trợ lý chủ tịch,8
kỹ sư môi trường,8
giám đốc tài chính,8
qa manager,8
nhân viên tư vấn trả góp kênh xe máy,8
nhân viên bán hàng kiêm thu ngân,8
nhân viên kinh doanh bđs,8
nhân viên điều phối hàng hóa,8
kế toán chi phí,8
nhân viên tư vấn qua điện thoại,8
tư vấn viên thẩm mỹ viện,8
phiên dịch viên tiếng hàn,8
nhân viên kế toán chi phí,8
trợ lý giám đốc tiếng trung,8
chuyên viên tư vấn tài chính bảo hiểm,8
chuyên viên mua hàng quốc tế,8
nhân viên tư vấn tài chính,8
nhân viên sales thị trường,8
nhân viên kinh doanh tại hà nội,8
senior graphic designer,8
sales supervisor,8
nhân viên vận hành,8
nhân viên kiểm tra chất lượng,8
cửa hàng trưởng ch thời trang,8
nhân viên kinh doanh sales,8
nhân viên truyền thông,8
chuyên viên kế hoạch sản xuất,8
tổ trưởng cửa hàng,8
nhân viên kỹ thuật ô tô,8
nhân viên seo marketing,8
nhân viên đào tạo,8
nhân viên kinh doanh kỹ thuật,8
nhân viên kế toán quỹ,8
store manager,8
cộng tác viên tuyển dụng,8
nhân viên kỹ thuật điện tử,8
nhân viên điều dưỡng,8
nhân viên sản xuất,8
trợ lý kinh doanh tiếng trung,8
senior sales executive,8
chuyên viên kinh doanh bđs,8
trưởng phòng kế toán,8
nhân viên hồ sơ thầu,8
nhân viên kinh doanh thuốc bảo vệ thực vật,8
nhân viên kinh doanh mỹ phẩm,8
tester,7
nhân viên điều phối,7
nhân viên mua hàng nhập khẩu,7
nhân viên kinh doanh sản phẩm phân bón thuốc bảo vệ thực vật,7
nhân viên chăm sóc khách hàng thời vụ viettel,7
nhân viên thiết kế designer,7
nhân viên may mẫu,7
nhân viên kinh doanh thang máy,7
chuyên viên tư vấn bán hàng,7
chuyên viên kinh doanh logistic express,7
chuyên viên sáng tạo nội dung,7
phụ trách kinh doanh khu vực,7
nhân viên thiết kế 2d,7
nhân viên content tiktok,7
chuyên viên tư vấn tài chính,7
nhân viên pha chế,7
nhân viên bảo trì điện lạnh,7
qa supervisor,7
chuyên viên kế toán thanh toán,7
trình dược viên otc etc,7
kỹ sư cầu đường,7
quản lý kinh doanh khu vực,7
product owner,7
nhân viên sales online,7
phó giám đốc xây dựng,7
chuyên viên phát triển sản phẩm,7
nhân viên vận hành sàn tmđt,7
thư ký giám đốc,7
trưởng phòng tài chính kế toán,7
nhân viên thiết kế kiến trúc nội thất,7
nhân viên kỹ thuật điện lạnh,7
nhân viên nghiên cứu và phát triển sản phẩm,7
lập trình viên,7
giám đốc trưởng phòng khách hàng cá nhân,7
nhân viên tư vấn kênh trả góp kênh xe máy điện máy,7
digital marketing manager,7
product specialist,7
host livestream,7
chuyên viên quan hệ khách hàng,7
chuyên viên xuất nhập khẩu,7
lái xe văn phòng,7
kỹ sư nhiệt lạnh,7
chuyên viên kế toán công nợ,7
cộng tác viên kinh doanh,7
trưởng nhóm kinh doanh online,7
tài xế lái xe cho giám đốc,7
đại diện bán hàng kênh gt,7
lễ tân hành chính,7
giám sát xây dựng,7
nhân viên kiểm duyệt hồ sơ viettel không yêu cầu kinh nghiệm,7
export sales executive,7
nhân viên tư vấn trả góp thu nhập lên đến 15 triệu,7
phiên dịch viên,7
chuyên viên tư vấn đầu tư,7
nhân viên chăm sóc khách hàng ngân hàng tpbank,7
nhân viên sáng tạo nội dung,7
kế toán tổng hợp đi làm ngay,7
kế toán doanh thu,7
devops engineer,7
phó phòng hành chính nhân sự,7
kỹ sư trắc địa,7
key account executive,7
nhân viên bán hàng qua điện thoại,7
nhân viên bán hàng không cần bằng cấp,7
nhân viên bán hàng showroom,7
nhân viên tài xế,7
nhân viên editor,7
customer service,7
chuyên viên marketing tổng hợp,7
nhân viên bán hàng nội thất cao cấp,7
content writer,7
nhân viên kinh doanh tiếp thị,7
back end developer,7
nhân viên bán hàng cao cấp làm việc tại trung tâm thương mại,7
sales admin staff,7
sale online,7
quản lý chuyên môn tiếng anh,7
nhân viên theo dõi đơn hàng,7
quản lý nhãn hàng,6
nhân viên sale logistics,6
chuyên viên hỗ trợ kinh doanh,6
trưởng phòng xuất nhập khẩu,6
nhân viên chăm sóc khách hàng vinaphone không yêu cầu kinh nghiệm,6
phó phòng marketing,6
chuyên viên marketing thương hiệu,6
chuyên viên brand marketing,6
nhân viên lái xe nâng,6
nhân viên phân tích nghiệp vụ,6
nhân viên c b,6
quản lý thi công,6
chuyên viên tư vấn bảo hiểm,6
kỹ sư cấp thoát nước,6
digital marketing specialist,6
nhân viên bán hàng bình dương,6
nhân viên bán hàng tại cửa hàng,6
chuyên viên thiết kế nội thất,6
chuyên viên giải phóng mặt bằng,6
regional sales manager,6
nhân viên telesale ngân hàng quốc tế singapore làm giờ hành chính nhận học vấn thpt,6
kỹ sư xây dựng dân dụng,6
nhân viên quản lý kho,6
phó giám đốc kinh doanh,6
trưởng bưu cục,6
nhân viên tuyển dụng đào tạo,6
giám đốc kinh doanh khu vực,6
nhân viên vận hành livestream,6
trưởng phòng phát triển kinh doanh,6
nhân viên trực tổng đài,6
chuyên viên kiểm toán nội bộ,6
chuyên viên tư vấn đầu tư khcn,6
giám đốc nhà máy,6
kế toán giá thành sản xuất,6
thực tập sinh content marketing,6
nhân viên kỹ thuật điện điện tử,6
kỹ sư bán hàng sales engineer,6
kỹ sư me,6
kỹ sư hvac,6
thư ký văn phòng,6
tiktok content creator,6
thợ điện,6
nhân viên tư vấn khóa học,6
sales team leader,6
thư ký chủ tịch hđqt,6
nhân viên mua hàng quốc tế,6
senior account executive,6
quản lý cửa hàng winmart,6
trợ lý marketing,6
chuyên viên khai báo hải quan,6
product developer,6
thợ cơ khí,6
trưởng phòng hcns,6
nhân viên tư vấn môi trường,6
nhân viên cskh đối tác viettel money,6
trưởng phòng pháp chế,6
kỹ thuật viên sản xuất,6
nhân viên giao hàng bằng xe máy,6
account manager,6
lễ tân,6
trưởng nhóm thiết kế,6
giám sát kinh doanh vùng,6
giám sát an toàn lao động,6
production supervisor,6
nhân viên quản lý sản xuất,6
quản lý khu vực kinh doanh,6
chuyên viên marketing ads,6
kiểm soát nội bộ,6
nhân viên tư vấn trả góp tư vấn tài chính,6
nhân viên kinh doanh thức ăn chăn nuôi,6
kế toán tổng hợp nội bộ,6
chuyên viên vận hành sàn thương mại điện tử,6
chuyên viên tư vấn bảo hiểm nhân thọ kênh liên kết ngân hàng bidv,6
trưởng ban pháp chế,6
nhân viên mua hàng nội địa,6
nhân viên quay phim,6
giám sát tuyển dụng,6
thợ hàn,6
chuyên viên khách hàng cá nhân,6
chuyên viên quản lý chất lượng,6
nhân viên cung ứng,6
tư vấn viên thẩm mỹ,6
giám sát bán hàng kênh mt,6
nhân viên tư vấn kênh trả góp kênh xe máy,6
chief accountant,6
content executive,6
brand marketing executive,6
nhân viên sales marketing,6
nhân viên bảo trì điện công nghiệp,6
kiến trúc sư chủ trì,6
giám sát kỹ thuật,6
nhân viên kinh doanh kênh đại lý,6
nhân viên kinh doanh nội thất cao cấp,6
nhân viên kế hoạch vật tư,6
nhân viên content seo,6
nhân viên kỹ thuật âm thanh,5
nhân viên tư vấn dịch vụ viettel,5
nhân viên kinh doanh thiết bị cơ khí,5
nhân viên chất lượng,5
nhân viên kinh doanh kênh siêu thị,5
kỹ thuật sản xuất,5
nhân viên giám sát camera,5
nhân viên vận hành máy phay cnc,5
nhân viên bán hàng thời trang nữ,5
giám sát thương mại,5
giám sát mep,5
chuyên viên tư vấn đầu tư chứng khoán,5
chuyên viên quản trị hệ thống,5
chuyên viên seo marketing,5
kỹ sư shop drawing,5
nhân viên tuyển dụng mass,5
nhân viên admin kho,5
nhân viên kinh doanh kênh b2b,5
chuyên viên iso,5
nhân viên điều phối dự án,5
cửa hàng phó,5
phụ tá nha khoa,5
nhân viên bán hàng đi làm ngay,5
nhân viên tiếng nhật,5
nhân viên cskh,5
nhân viên kinh doanh nội thất tại hcm,5
giám đốc nhân sự,5
chuyên viên chuyên viên chính chuyên viên cao cấp khách hàng doanh nghiệp,5
nhân viên chăm sóc khách hàng tiếng nhật,5
thư ký tổng giám đốc,5
trưởng phòng qa qc,5
chuyên viên quan hệ khách hàng cá nhân,5
nhân viên social media,5
quản lý bếp ăn công nghiệp,5
phụ bếp,5
nhân viên hành chính tổng hợp,5
kế toán tài sản,5
nhân viên dự toán,5
chuyên viên phát triển đại lý,5
b2b sales executive,5
trưởng nhóm quản lý chất lượng,5
kế toán tổng hợp tại hà nội,5
chuyên viên phát triển kinh doanh b2b,5
phụ trách kinh doanh,5
cán bộ kỹ thuật hiện trường,5
kỹ sư an toàn lao động,5
kỹ sư sản xuất,5
trưởng nhóm thương mại điện tử,5
kỹ sư dự án,5
giáo viên ngữ văn,5
bếp trưởng,5
nhân viên phát triển sản phẩm,5
cửa hàng trưởng nhà thuốc,5
nữ hộ sinh,5
nhân viên kinh doanh hóa chất,5
kế toán sản xuất,5
nhân viên phát triển đại lý,5
quản lý spa,5
trưởng phòng chăm sóc khách hàng,5
nhân viên kinh doanh tư vấn bán hàng,5
kỹ sư công trình,5
telemarketing team leader,5
project coordinator,5
trưởng phòng tài chính,5
nhân viên bếp nhà hàng,5
trưởng phòng trade marketing,5
nhân viên lập trình,5
nhân viên kho hàng,5
trưởng phòng vận hành,5
tài xế lái xe,5
chuyên viên qa,5
phiên dịch tiếng nhật,5
accountant,5
họa viên kiến trúc,5
nhân viên kinh doanh mt,5
thực tập sinh,5
kỹ sư dự toán,5
quản lý vận hành trường mầm non,5
tập sự tư vấn đầu tư,5
nhân viên sàn thương mại điện tử,5
nhân viên bán hàng online,5
data analyst,5
nhân viên mua hàng purchasing staff,5
trợ lý tổng giám đốc tiếng trung,5
nhân viên livestream bán hàng,5
chuyên viên tư vấn bảo hiểm kênh hợp tác ngân hàng ocean bank,5
marketing facebook ads,5
nhân viên nghiệp vụ,5
trợ lý phiên dịch tiếng trung,5
chuyên viên tư vấn chuyên viên kinh doanh sales bán hàng thu nhập từ 16 triệu trở lên hồ chí minh,5
nhân viên seo web,5
talent acquisition executive,5
trưởng phòng thu mua,5
chuyên viên video editor,5
nhân viên kỹ thuật lắp đặt,5
giám sát an toàn,5
trưởng phòng kinh doanh online,5
unity developer,5
kỹ sư hạ tầng đô thị,5
nhân viên chăm sóc khách hàng customer service,5
chuyên viên chuyên viên cao cấp tư vấn đầu tư khách hàng cá nhân,5
biên tập viên,5
biên phiên dịch tiếng trung,5
nhân viên thống kê,5
kỹ sư thiết kế pccc,5
web designer,5
kỹ sư xây dựng đi làm ngay,5
nhân viên design,5
chuyên viên điều tra gian lận,5
trưởng phòng kinh doanh dự án,5
ecommerce manager,5
nhân viên hành chính kế toán trang trại,5
nhân viên it support,5
thư ký kinh doanh,5
nhân viên ie,5
nhân viên giám sát,5
trưởng phòng thiết kế,5
nhân viên bán hàng thị trường,5
giám sát khu vực,5
nhân viên hành chính văn phòng biết tiếng trung,5
nhân viên tổng vụ,5
nhân viên kiểm toán nội bộ,5
nhân viên bán hàng đà nẵng,5
nhân viên thu mua tiếng trung,5
designer,5
trợ lý phó tổng giám đốc,5
giám sát nội thất,5
marketing team leader,5
nhân viên bếp bánh,5
nhân viên bảo trì tòa nhà,5
chuyên viên kinh doanh phần mềm,5
nhân viên bếp,5
nhân viên tiếng trung,5
giám sát chuyên môn tiếng anh,5
nhân viên an ninh,5
giám đốc kinh doanh bất động sản,5
trợ lý,5
kỹ sư an toàn,5
nhân viên kĩ thuật,5
trưởng phòng kế hoạch,5
kế toán tổng hợp kiêm kế toán thuế,5
chuyên viên quản lý tài sản,5
nhân viên tuyển dụng và đào tạo,5
nhân viên buồng phòng,5
nhân viên quay dựng video editor,5
trợ lý giám đốc kinh doanh,5
nhân viên chăm sóc khách hàng sàn thương mại điện tử,5
kỹ sư thiết kế cơ điện,5
nhân viên tư vấn internet mạng viettel,5
telesale,5
nhân viên seo website,5
nhân viên sales logistics,5
chuyên viên tư vấn giáo dục lương 13 triệu tháng,5
nhân viên chăm sóc khách hàng kênh chat không yêu cầu kinh nghiệm,5
