job_title,so_viec_lam
nhân viên nông học thực địa,1
nhân viên tiếng anh,1
cửa hàng phó khu vui chơi champion 1250,1
nhân viên thiết kế nội thất căn hộ nhà phố,1
sales supervisor hòa bình,1
cầu giấy thực tập sinh tuyển dụng fulltime parttime hỗ trợ dấu mộc thực tập,1
chuyên viên tư vấn giáo dục ocean edu gia lộc thu nhập từ 13 triệu trở lên phỏng vấn đi làm ngay,1
cán bộ kỹ thuật hiện trường khối lượng,1
kỹ sư giám sát thi công cơ điện không yêu cầu kinh nghiệm,1
kế toán dịch vụ thuế đi làm ngay,1
nhân viên kỹ thuật hiệu chuẩn thử nghiệm đo lường máy móc thiết bị,1
nhân viên hiện trường,1
nhân viên sale thị trường thu nhập không giới hạn,1
bến tre giám sát kinh doanh kênh điện máy,1
nhân viên triển khai sự kiện,1
kế toán hành chính chi nhánh,1
đầu bếp chính nấu cơm văn phòng,1
chuyên viên da liễu tư vấn viên,1
giáo viên tiếng anh fulltime đi làm sau tết,1
bảo vệ đi làm ngay tại các khu vực hà đông cầu giấy hai bà trưng thanh xuân linh đàm hà nội,1
chuyên viên tuyển sinh ocean edu vĩnh tường thu nhập hấp dẫn từ 13 triệu tháng phỏng vấn đi làm ngay,1
nhân viên kỹ thuật tại hải phòng,1
nhân viên bán hàng viettelstore tại từ sơn bắc ninh,1
nhân viên bán hàng gia dụng toshiba,1
trưởng phòng quan hệ lao động,1
kinh doanh kênh online,1
nhân viên kế toán làm việc đức hòa long an,1
technique service staff,1
nhân viên kinh doanh thuộc chi nhánh hà nội công ty worldtrans,1
senior logistic,1
nhân viên kỹ thuật pha chế,1
kỹ sư qc quản lý chất lượng xây dựng,1
quản lý trang trại bò sữa,1
ninh hòa khánh hòa nhân viên tư vấn trả góp smc kh,1
chuyên viên seo content,1
chỉ huy trưởng tại bắc ninh,1
giám sát bán hàng kênh truyền thống đồng nai,1
chuyên viên khách hàng cá nhân phòng giao dịch châu đức cn vũng tàu,1
nhân viên bán hàng thời trang vincom bạc liêu,1
điều dưỡng viên tại long an,1
thợ mài,1
chuyên viên xử lý nợ ngoại bảng tín chấp,1
nhân viên thu mẫu xét nghiệm,1
nhân viên kinh doanh kỹ thuật 10 20 triệu,1
nhân viên khởi kiện phòng quản lý công nợ,1
giám đốc trung tâm công nghệ blockchain,1
nhân viên telesale phát triển khách hàng hà nội,1
nhân viên thu phí tín dụng thị trường,1
telesales part time,1
nhân viên call center thẩm mỹ,1
chuyên viên ub phòng giao dịch thuận thành cn kinh bắc,1
tuyển nhân viên biên tập viên nha khoa,1
chuyên gia khoa học dữ liệu msb dt 1m470,1
tổ trưởng pcba,1
công nhân điện,1
shinhan finance khánh hòa nhân viên tư vấn kinh doanh,1
chuyên viên đấu thầu thanh quyết toán,1
chuyên viên ub cn nam định,1
nhân viên kinh doanh ngành du lịch không cần kinh nghiệm lương upto 50 triệu,1
chuyên viên kinh doanh chuyển phát nhanh logistics thu nhập từ 10tr 20tr hoa hồng,1
chuyên viên khách hàng cá nhân cn tam hiệp,1
nhân viên xúc tiến đầu tư,1
phó giám đốc kỹ thuật sản xuất,1
nv cv thu hồi nợ qua điện thoại hà nội hcm ta149,1
điều dưỡng khoa nhi hồi sức sơ sinh,1
quản lý cửa hàng quận 1 sisley,1
tổ trưởng it,1
nhân viên chăm sóc khách hàng b2b lương cứng upto 15 triệu tháng,1
brse pm từ 1 năm kinh nghiệm tiếng nhật n2 up to 2500 gross,1
nhân viên bán vé máy bay và sản phẩm du lịch,1
vận hành quản lý sàn thương mại điện tử amazon shopify ebay,1
công nhân pha lọc,1
nhân viên đăng bài online cộng tác viên tuyển dụng,1
lập trình viên fullstack,1
erp sap consultant,1
tổ trưởng kinh doanh,1
nhân viên chăm sóc khách hàng tại tân bình,1
thiết kế đấu thầu hệ điện điện nhẹ,1
nhân viên kỹ thuật bảo trì điện 机电技术员,1
nhân viên bán hàng nông sản,1
nhân viên kinh doanh đăk lăk,1
nodejs backend developer,1
trưởng phòng kinh doanh y tế,1
chuyên viên ub phòng giao dịch võ nguyên giáp cn nam hải phòng,1
qc executive dc dĩ an bình dương,1
chủ trì dự toán,1
thợ máy chấn hoặc laser,1
trưởng nhóm kinh doanh tại hà nội,1
nhân viên ba phân tích dữ liệu,1
nam nhân viên kỹ thuật phòng lab,1
chuyên viên product designer,1
admin kế toán khu vực hà nội,1
chuyên viên phát triển kinh doanh kol,1
nhân viên chứng từ hàng nhập,1
bsv tuyển tổng đài viên chăm sóc khách hàng viettel xoay ca,1
tài xế xe tải xe container,1
chỉ huy phó xây dựng,1
nhân viên phục vụ parttime,1
nhân viên kho – công trình khánh hòa,1
chuyên viên tư vấn tài chính thu nhập cố định từ 12 triệu trở lên,1
nhân viên kinh doanh phần mềm hà nội,1
trưởng chi nhánh miền trung,1
nhân viên kaizen tiếng nhật tiếng nhật n2 upto 14m gross có hỗ trợ xe đưa đón,1
hà đông nhân viên ban giao dịch và đàm phán,1
nhân viên admin outsource,1
senior data analyst,1
senior tester – msb 1y561,1
nhân viên kinh doanh xuất khẩu,1
nhân viên cutting,1
trưởng nhóm marketing online,1
trợ lý tiếng trung vận hành,1
thủ kho khu vực quận bình tân,1
chuyên viên kinh doanh trái phiếu và đầu tư,1
trợ lý thông dịch viên tiếng hàn,1
nhân viên tư vấn tuyển sinh sales kinh doanh consultant ila hóc môn quận 12,1
nhân viên tư vấn dịch vụ đối tác ngân hàng quốc tế singapore,1
chuyên viên telesales viettel làm tại trung kính cầu giấy hà nội,1
nhân viên phụ bếp nhà hàng 5 sao,1
devops testing engineer,1
content creator đi làm ngay,1
kỹ sư quản lý nhà cung cấp,1
trưởng phòng kiểm soát rủi ro,1
sales executive b2b,1
assistant finance manager,1
phó phòng thu mua,1
nhân viên vận hành trạm xử lý nước thải,1
sân bay nội bài nhân viên đón tiễn khách sân bay,1
kỹ thuật viên chăm sóc xe thái nguyên,1
chuyên viên kinh doanh phần mềm lĩnh vực tmđt fnb tại văn phòng kiên giang,1
nhân viên triển khai bản vẽ 2d lương 15 25 triệu,1
pháp lý dự án xây dựng,1
nhân viên kế hoạch đào tạo,1
kỹ sư giám sát hiện trường không yêu cầu kinh nghiệm,1
trưởng nhóm kinh doanh bán lẻ,1
nhân viên buồng phòng làm việc trên du thuyền 5 sao,1
kế toán nội bộ thu nhập từ 9 triệu đến 10 triệu,1
trưởng nhóm kỹ thuật camera,1
nhân viên chăm sóc khách hàng lĩnh vực dinh dưỡng giờ hành chính,1
chuyên viên visual merchandise,1
trưởng nhóm cskh quản lý lớp học,1
sales logistic upto 15 30 triệu tháng,1
designer drafter,1
giám đốc kinh doanh online,1
nhân viên booker vé máy bay,1
trưởng nhóm cskh và giải quyết khiếu nại,1
nhân viên hỗ trợ thanh toán tại địa bàn tân kỳ cfi na,1
giám đốc kinh doanh hà nội,1
chuyên viên quan hệ khách hàng onebank hồ chí minh,1
nhân viên trưng bày brand tommy hilfiger hồ chí minh,1
chuyên viên cao cấp quản lý sản phẩm thấu chi hồ chí minh ta161,1
chuyên viên tập sự khách hàng cá nhân phòng giao dịch hoàng diệu cn khánh hòa,1
nhân viên nhập khẩu và chứng từ hải quan kiêm admin,1
sale customer service,1
district manager,1
nhân viên kinh doanh sắt thép,1
nhân viên kỹ thuật ra file cnc,1
chuyên viên tập sự khách hàng cá nhân phòng giao dịch lâm thao cn việt trì,1
nhân viên qc xây dựng,1
project executive,1
trợ lý thư ký chủ tịch hđqt,1
nhân viên thủ kho khách sạn,1
trưởng nhóm kinh doanh xuất nhập khẩu,1
quản lý bán hàng khu vực ngành sữa bột đông bắc,1
learning experience officer vĩnh yên vĩnh phúc,1
kỹ sư điện lạnh phòng r d,1
nhân viên kinh doanh giao hàng tận nhà tp hcm,1
nhân viên kinh doanh lương lên tới 30 triệu,1
cộng tác viên otc,1
nhân viên tư vấn trả góp smc yb,1
nhân viên tư vấn làm việc tại tân bình,1
điều dưỡng phụ nội soi,1
nhân viên photoshop,1
thợ sửa điện tử phần cứng máy tính,1
bắc từ liêm nhân viên trực tổng đài 198 viettel không yêu cầu kinh nghiệm,1
nhân viên kinh doanh lương cơ bản 9 12tr,1
biên phiên dịch tiếng nhật n1 upto 1000 gross,1
nhân viên kiểm kê tài sản,1
nhân viên sửa chữa điện,1
nhân viên bán hàng qua tổng đài telesale viettel làm việc giờ hành chính tại hòa lạc thạch thất,1
nhân viên logistic logistics executive,1
nhân viên bán hàng tại hoàng mai hà nội,1
nhân viên bán hàng bắc ninh,1
chuyên viên phát triển kinh doanh sales executive,1
kế toán nội bộ ba đình hà nội,1
graphic designer supervisor,1
nhân viên kinh doanh kênh chợ,1
kỹ sư thiết kế có tiếng nhật id25715,1
chuyên viên khách hàng doanh nghiệp phòng giao dịch phú hộ cn việt trì,1
chuyên viên tập sự ub phòng giao dịch vạn mỹ cn hải phòng,1
phó giám đốc chi nhánh phụ trách mảng khdn chi nhánh tân an,1
chuyên viên xử lý nợ tố tụng,1
thợ chính,1
nhân viên tư vấn trực page,1
cse chăm sóc khách hàng,1
giám đốc kinh doanh khu vực kem dẻo thổ nhĩ kỳ khu vực khánh hòa phú yên bình định,1
nữ cộng tác viên bán hàng hà nội,1
nhân viên kỹ sư công nghệ lạnh,1
nhân viên kinh doanh tư vấn sales mảng tài chính thu nhập đến 40 triệu,1
lập trình viên ứng dụng tại hà nội,1
kế toán tín dụng,1
sale admin hà nội,1
nhân viên bếp bánh paris baguette mỹ đình không yêu cầu kinh nghiệm,1
quản lý dịch vụ khách hàng,1
quản lý spa thẩm mỹ,1
senior product designer,1
phó phòng vận tải hành khách,1
nhân viên bốc xếp hàng hóa hành lý sân bay tân sơn nhất,1
asm làm việc tại vp hà nội,1
chuyên viên tuyển dụng talent acquisition specialist,1
cán bộ hồ sơ y tế,1
senior trade marketing manager,1
nhân viên tư vấn đăng ký gói cước viettel làm việc giờ hành chính tại hòa lạc thạch thất hà nội,1
branding communications executive,1
trưởng nhóm an toàn,1
trưởng nhóm tuyển sinh ocean edu yên định thu nhập hấp dẫn từ 15 triệu tháng phỏng vấn đi làm ngay,1
công nhân nhân viên ươm tơ,1
chuyên viên kinh doanh quản lý tài sản,1
nhân viên chăm sóc khách hàng đài truyền hình vtvcab fulltime xoay ca linh hoạt có hỗ trợ mộc thực tập,1
chuyên viên kế toán full time 2024,1
internal communication cum eb,1
giám sát bán hàng đà nẵng mothercare,1
quản lý cửa hàng thời trang nữ cao cấp,1
nhân viên sales admin làm việc tại dĩ an,1
trưởng phòng chăm sóc khách hàng up to 25m,1
cad pattern garment nhân viên thiết kế rập,1
104996 piping engineer water treatment,1
chuyên viên thiết kế ui ux,1
nhân viên giao hàng xe máy đi làm ngay,1
thiết kế chế bản ngành bao bì carton,1
nhân viên bóc tách kỹ thuật nội thất,1
nhân viên bảo hành kỹ thuật,1
visual merchandise executive,1
chuyên viên pháp chế nữ,1
tổng đài viên hỗ trợ dịch vụ vtvcab fulltime parttime,1
nhân viên kinh doanh kv hà nội,1
nhân viên chăm sóc khách hàng kiểm duyệt nội dung,1
chuyên viên điều phối chuyên mảng social,1
công ty tnhh central security tuyển dụng bảo vệ,1
nhân viên hóa nghiệm,1
nhân viên kinh doanh vlxd không yêu cầu kinh nghiệm,1
kiểm soát viên cn bình định,1
trình dược viên chuỗi nhà thuốc,1
talent acquisition project recruiter,1
giám sát bán hàng khu vực tp thủ đức,1
trưởng nhóm sản xuất 20m,1
nhân viên digital marketing facebook,1
senior financial planning analysis specialist chuyên viên cao cấp phân tích tài chính,1
phó phòng kế hoạch vật tư,1
kế toán bán hàng kho,1
phó phòng quản trị hc nhân sự,1
thủ kho phụ tùng ô tô,1
trình dược viên bắc ninh,1
chuyên viên hành chính nhân sự bđs hà nội,1
nhân viên bán hàng tại thuận an,1
chuyên viên kinh doanh tư vấn bán hàng lương cứng lũy tiến tới 20 triệu,1
112291 compliance and security staff fintech,1
gsd leader,1
nhân viên quản lý sản xuất và kho id25806,1
nhân viên skinner salon làm việc tại bà rịa vũng tàu,1
chuyên viên khách hàng doanh nghiệp cn nam khánh hòa,1
thực tập sinh seo quản trị kênh,1
kỹ sư dự án project engineer,1
chuyên viên kinh doanh đào tạo sản phẩm thu nhập trung bình 30 triệu tháng,1
kỹ sư shop drawing detailing engineer,1
assistant strategic planning manager creative planner,1
chuyên viên tập sự khách hàng doanh nghiệp cn bắc hải phòng,1
it service desk msb kcn 3i110,1
cộng tác viên thiết kế cấp bậc mobile game,1
quản lý dự án dịch vụ giáo dục đào tạo cho dn nhật,1
chăm sóc khách hàng ca sáng thủ đức,1
sale leader mảng phần mềm,1
thiết kế nội thất katinat saigon kafe,1
sale khách sạn ota,1
tts content marketing mảng cho thuê căn hộ,1
nhân viên thị trường vĩnh phúc,1
nhân viên điều độ xuất hàng,1
nhân viên sales admin ocean edu hà giang thu nhập hấp dẫn từ 13 triệu tháng trở lên phỏng vấn đi làm ngay,1
kế toán bảo hiểm,1
project manager thu nhập 20 40 triệu,1
nam nhân viên thiết kế đồ họa graphic designer,1
software quality assurance engineer,1
nhân viên bán hàng quận phú nhuận,1
nhân viên telesales đặt lịch hẹn,1
nhân viên phục vụ nữ thu nhập trên 20 triệu,1
nhân viên chỉnh sửa hình ảnh,1
nhân viên hàn áp lực đi làm ngay,1
chuyên viên thu hồi nợ trực tiếp tp hcm,1
nhân viên seo seo associate,1
internal auditor – internal audit department h o,1
chuyên viên kiểm soát quy trình,1
nhân viên brand social marketing,1
chuyên viên tư vấn bất động sản hàng hiệu,1
giáo viên thcs thpt dạy online toàn quốc,1
trình dược viên otc hải dương,1
quản lý xưởng nhôm kính,1
nhân viên giao nhận hải phòng,1
lễ tân kiêm thu ngân,1
kỹ thuật điện thi công điện mặt trời,1
nhân viên kinh doanh nguyên liệu dược – api sales executive,1
entry level marketing associate,1
nhân viên kinh doanh xuất nhập khẩu tiếng trung,1
trưởng phòng cao cấp marketing,1
nhân viên chăm sóc khách hàng dự án viettel line 198 không yêu cầu kinh nghiệm,1
nhân viên điều phối dự án nông nghiệp,1
nhân viên phát triển thị trường khu vực quận 12 hóc môn,1
kế toán tiền mặt không yêu cầu kinh nghiệm,1
thực tập sinh thiết kế đồ họa 2d,1
quản lí cửa hàng,1
giáo viên gia sư tiếng đức tiếng thái tiếng pháp tiếng tây ban nha tiếng séc tiếng nga online part time,1
chuyên viên y khoa đào tạo,1
nhân viên chăm sóc khách hàng tiếng nhật n1 và n2,1
nhân viên kỹ thuật điện giám sát hiện trường,1
phiên dịch tiếng trung quốc,1
nhân viên chăm sóc khách hàng làm việc giờ hành chính,1
nhân viên phụ trách đào tạo biết tiếng trung,1
chuyên viên quản lý mạng xã hội,1
chuyên viên phát triển nội dung quảng cáo,1
nhân viên kết cấu,1
giám sát phòng technical planning,1
nhân viên kinh doanh kênh mt khu vực ocean park 1 2 3,1
chuyên viên tập sự ub cn hải phòng,1
giám sát kinh doanh gt khu vực hà nội ngành công cụ dụng cụ,1
hr quản lí nhân sự,1
trưởng bộ phận bán hàng đa kênh,1
giồng trôm bến tre trưởng ca sản xuất,1
mc content media,1
nhân viên vận hành nhà máy thủy điện,1
kỹ thuật viên bảo hành linh kiện máy tính,1
job ngân hàng nhân viên hỗ trợ dịch vụ khách hàng cho ngân hàng mb bank không yêu cầu kinh nghiệm làm giờ hành chính,1
nhân viên kinh doanh phát triển thị trường hà nội hải phòng quảng ninh,1
nhân viên tuyển dụng part time,1
tư vấn bán hàng mỹ phẩm paula s choice làm tại cửa hàng,1
trưởng phòng thiết kế giày dép,1
qa qc staff mảng thực phẩm upto 13m gross,1
nhân viên kinh doanh mảng thức ăn chăn nuôi,1
nhân viên kiểm tra chất lượng sản phẩm điện tửđiện,1
nhân viên account marketing,1
trưởng nhóm dự án,1
nhân viên kiểm duyệt hồ sơ khách hàng viettel,1
content marketing tổng hợp định hướng seo,1
kỹ sư plc,1
nhân viên đội đào tạo đặc nhiệm task force team,1
nhân viên cskh biết tiếng anh,1
nhân viên kinh doanh – tư vấn căn hộ,1
chuyên viên khách hàng cá nhân phòng giao dịch uyên hưng cn bình dương,1
giáo viên dạy toán trí tuệ,1
nhân viên phòng kiểm soát nội bộ id25765,1
chuyên viên hành chính nhân sự tông hợp cn chương mỹ hà nội,1
marketing sales staff từ 1 năm kinh nghiệm 20 triệu gross,1
kỹ thuật sửa chữa xe nâng hơn 2 năm kinh nghiệm,1
tuyển tài xế bằng b2 tải 1 5 tấn bình chánh hcm,1
nhân viên pha chế bookcafe phương nam chi nhánh hải phòng,1
chuyên viên tư vấn du học biết tiếng trung,1
nhân viên cskh kênh 198 viettel không yêu cầu kinh nghiệm,1
trưởng phòng kinh doanh chuỗi bán lẻ,1
kế toán trưởng lương 20 25 triệu tháng,1
trưởng phòng kinh doanh hồ chí minh từ 25 35 triệu,1
gia lai nhân viên hỗ trợ thanh toán tại địa bàn đức cơ cfi gl,1
chuyên viên digital ads – facebook tiktok google ads bình thạnh,1
chuyên viên giáo vụ tại trà vinh,1
nữ bán hàng thị trường tại nam định,1
nhân viên bán hàng lương cứng 10 triệu thu nhập lên đến 50 triệu đi làm ngay,1
nhân viên kinh doanh cước vận tải quốc tế sale logistics,1
nhân viên cơ điện bảo trì máy,1
nhân viên kinh doanh thị trường nhựa nội thất,1
nhân viên kinh doanh audio,1
student care officer hcm,1
nhân viên hành chính nhân sự tại tây nguyên,1
chuyên viên giáo vụ tại buôn mê thuột,1
nhân viên xử lý nợ địa bàn long an,1
kế toán tổng hợp thu nhập up to 20tr,1
trình dược viên đi thị trường,1
chuyên viên tư vấn bảo hiểm kênh ngân hàng vietinbank tuyên quang,1
chuyên viên kiểm thử,1
chuyên viên tư vấn giáo dục ocean edu vĩnh tường lương từ 13 triệu tháng,1
nhân viên kinh doanh phát triển thị trường khu vực cần thơ,1
nhân viên sale fulfilment,1
118106 sales representative chemicals machinery,1
kiến trúc sư thiết kế kết cấu,1
chuyên viên khách hàng cá nhân phòng giao dịch thuận thành cn kinh bắc,1
leader it,1
nhân viên sản xuất thực tập sinh nhật bản,1
tổng đài viên truyền hình vtvcab,1
nhân viên it admin,1
chuyên viên kinh doanh thu nhập từ 8 25 triệu nghỉ thứ 7 chủ nhật,1
tài xế lái xe cho tổng giám đốc,1
nhân viên kỹ thuật lương từ 15 triệu,1
brewery technician,1
nhân viên y tế hành chính,1
chuyên viên khách hàng cá nhân phòng giao dịch quán toan cn bắc hải phòng,1
chuyên viên tập sự ub cn bảo lộc,1
giám sát khu vui chơi làm tại aeon mall long biên,1
kỹ sư xây dựng lương từ 13 đến 20 triệu,1
nhân viên cơ điện đồng nai,1
nhân viên thu ngân thẩm mỹ viện,1
intern content tiktok,1
sales coordinator trợ lý hỗ trợ kinh doanh,1
trình dược viên otc tuyên quang,1
chuyên viên tuyển dụng lương 15 triệu,1
112342 m e design operator construction kỹ sư thiết kế m e ngành xây dựng,1
kiến trúc sư thiết kế nhà xưởng lương cao thu nhập hấp dẫn,1
việc làm full time part time nhân viên chăm sóc khách hàng dự án k,1
mega gangnam bác sĩ da liễu pttm,1
chuyên viên trắc địa,1
lễ tân khách sạn,1
thời vụ nhân viên quản lý kho thành phẩm đi làm ngay,1
chuyên viên tư vấn giáo dục ocean edu ninh bình lương từ 13 triệu tháng phỏng vấn đi làm ngay,1
nhân viên bán hàng tp quảng ngãi,1
giáo viên tâm lý trung học pathway school,1
nhân viên vận hành sản xuất và kỹ thuật,1
chuyên viên tư vấn hợp tác đối tác chủ xe,1
thư ký kiêm theo đơn,1
nhân viên chứng từ xnk,1
nhân viên tư vấn chăm sóc khách hàng ktv spa,1
senior 2d artist chuyên viên vẽ minh họa,1
kế toán quản trị management accountant cum purchasing,1
chuyên viên quản trị rủi ro,1
quản lý bếp ăn bệnh viện truyền máu huyết học bình chánh hcm,1
chuyên viên phó phòng hse iso,1
quản lý cửa hàng tokyolife – khu vực hải dương,1
chuyên viên kinh doanh thị trường tã bỉm,1
trưởng phòng đảm bảo chất lượng bán hàng,1
nhân viên quản trị website bán hàng và fanpage,1
trợ lý ceo kiêm quản lý nhân sự,1
nhân viên content brand,1
cán bộ kỹ thuật công trình lương từ 10 17 triệu,1
thành phố lai châu nhân viên tư vấn tín dụng trả góp sản phẩm smc lcu,1
nhân viên vậnh hành máy,1
nam nhân viên kỹ thuật ghép phôi,1
hcm nhân viên quản lý khách hàng,1
nhân viên kỹ thuật lương từ 10 12 triệu,1
nhân viên lễ tân phòng khám da liễu,1
nhân viên học vụ đào tạo,1
nhân viên kinh doanh mảng thiết bị điện dân dụng,1
nhân viên kinh doanh nội thất tại bình tân,1
chuyên viên kscl nghiệm thu nội bộ,1
nhân viên kỹ thuật vật liệu,1
nhân viên kinh doanh thu nhập từ 10 20 triệu,1
marketing and communication executive,1
bim cad modeller,1
giám sát kinh doanh khu vực miền tây các tỉnh từ đà nẵng,1
công nhân thao tác,1
công nhân may thủ công,1
nhân viên thu ngân lương trung bình 12 15 triệu tháng,1
nhân viên kế toán thuế ngành f b,1
trưởng nhóm tuyển sinh ocean edu tuyên quang thu nhập hấp dẫn từ 15 triệu tháng,1
kiến trúc sư kỹ sư triển khai bản vẽ thi công,1
nhân viên phát triển màu hà nam,1
chuyên viên khách hàng cá nhân phòng giao dịch sóng thần cn nam bình dương,1
cán bộ qs dân dụng công nghiệp,1
chuyên viên cao cấp quản lý bán hàng phòng phát triển kinh doanh khối khách hàng cá nhân,1
operations director,1
biên phiên dịch tiếng nga,1
nhân viên tư vấn căn hộ lương cơ bản đến 16tr hoa hồng lên đến 50 100tr,1
nhân viên kỹ thuật đo,1
chuyên viên tập sự khách hàng cá nhân phòng giao dịch đông bình chánh cn tân tạo,1
nhân viên bán hàng hà nam,1
giám sát m e,1
109881 channel sales manager trưởng phòng kinh doanh sỉ electronics equipment,1
kỹ sư camera,1
qs mep engineer id24569,1
kỹ sư m e có kinh nghiệm làm qs qc,1
senior b2b sale executive,1
hcm chuyên viên tư vấn,1
sale logistics executive,1
nhân viên xây dựng kênh tiktok,1
quản lý khách hàng khu vực nam trung bộ,1
chuyên viên tập sự khách hàng cá nhân cn khánh hòa,1
nhân viên tư vấn trả góp tại cửa hàng điện thoại xe máy cao bằng smc cb,1
kỹ sư cơ điện miền bắc miền trung,1
sóc trăng nhân viên hỗ trợ thanh toán tại địa bàn,1
secretary of general director,1
chuyên viên hành chính nhân sự long an,1
giao dịch viên tài chính tại pnj phú mỹ bà rịa vũng tàu,1
nhân viên lấy hàng,1
trưởng phòng kinh doanh bđs hcm,1
giám sát công trình 2 năm,1
chuyên viên tập sự khách hàng doanh nghiệp phòng giao dịch trung đô cn nghệ an,1
sale admin chăm sóc khách hàng mảng viễn thông doanh nghiệp,1
trình dược viên otc tp hồ chí minh lương từ 15 20 triệu,1
master phun xăm hệ thống,1
nhân viên chăm sóc trải nghiệm khách hàng,1
event activation executive,1
trình dược viên bắc ninh bắc giang hưng yên hải phòng,1
chuyên viên khách hàng cá nhân phòng giao dịch vĩnh hải cn khánh hòa,1
tổng đài viên mạng cố định dự án viettel,1
nhân viên kinh doanh ban phát triển miền trung cn bình định,1
phó ban hành chính nhân sự,1
đoàn kết tp lai châu nhân viên tư vấn trả góp smc lcu,1
asm miền bắc,1
nhân viên phát triển bền vững farm staff,1
kỹ sư thiết kế cơ khí r d mechanical design engineer,1
senior php engineer,1
chuyên viên bảo trì đi làm ngay,1
bắc từ liêm nhân viên chăm sóc khách hàng tổng đài viettel không yêu cầu kinh nghiệm,1
chuyên viên qa xưởng sản xuất,1
giáo viên gia sư tiếng nga online part time,1
nhân viên kinh doanh thị trường lương cơ bản 10 12 triệu,1
báo chí,1
nhân viên tư vấn trả góp tại cửa hàng điện thoại sed yb,1
nhân viên sale admin kinh doanh tại hà nội,1
nhân viên văn phòng nhận việc sau tết,1
kỹ sư điện mặt trời – máy phát điện,1
nhân viên kế toán kho bình tân đi làm ngay,1
giáo viên việt nam năm học 2025 2026,1
